basepk,hid,speechdate,pid,opid,speakeroldname,speakerposition,maintopic,subtopic,subsubtopic,speechtext,speakerparty,speakerriding,speakername,speakerurl
3498772,ca.proc.d.1984-11-29.1,1984-11-29,,,,topic,GOVERNMENT ORDERS,,,,,,,
3498773,ca.proc.d.1984-11-29.1.1,1984-11-29,,,,subtopic,GOVERNMENT ORDERS,"BORROWING AUTHORITY ACT, 1984-85 (No. 2) MEASURE TO ENACT",,,,,,
3498774,ca.proc.d.1984-11-29.1.1.1.1,1984-11-29,,,,stagedirection,,,,"The House resumed from Wednesday, November 28, consideration of the motion of Mrs. McDougall that Bill C-ll, an Act to provide borrowing authority, be read the second time and referred to the Standing Committee on Finance, Trade and Economic Affairs; and the amendment thereto of Mr. Riis (p. 694).",,,,
3498775,ca.proc.d.1984-11-29.1.1.2,1984-11-29,968a91bc-c011-4025-8441-b63d8599dc05,ca.m.4018,Mrs. Barbara Sparrow (Calgary South):,,GOVERNMENT ORDERS,"BORROWING AUTHORITY ACT, 1984-85 (No. 2) MEASURE TO ENACT",,"Mr. Speaker, I am pleased to participate in this debate in support of Bill C-ll. I would first like to commend the Minister for introducing this Bill which will enable us to borrow the most necessary funds to keep the country going. The Government must borrow to meet its financial requirements. We have produced the facts that are necessary for speedy consideration of this Bill.
In his economic statement the Minister of Finance (Mr. Wilson) advised Canadians that adjustments, cuts and new initiatives were needed to support and encourage economic recovery, to create jobs, and to give Canadians the confidence and stability to invest in this great country in order that it will move forward. The Government promised to take control and it is doing just that. The economic situation which we inherited after years of Liberal mismanagement calls for some tough specific actions, but they will be sound. Running the country is exactly like running any business. We all know that when expenses are greater than revenues a deficit is created. The Government was elected to deal with the challenges facing the country and the deficit is one of our greatest challenges.
Canadians have given the Government a strong mandate to embark on the long, complex and painful task of building a lasting economic consensus for our nation. I believe Canadians know that the Government is approaching, and will continue to approach, Canada's problems. Paying the bills is one of our problems. The Government is moving with compassion, commitment and fairness.
To put our own fiscal house in order and to reverse the massive buildup of public debt, we must and will meet our commitments. Many of these commitments were made by the previous government. We are going to honour our commitments. We are honest, sincere and open. The people of Canada want, and shall receive, fair treatment, Mr. Speaker. They voted for a Government that will get the country back on its feet. Through extensive consultation and communication with the provinces, business people, labour and all Canadians, the Government will make fair decisions for all regions of Canada. We will no longer see confrontation and unilateral decisions, for the Government has a responsibility. It is facing reality. We can no longer meet every need. We simply cannot do it all.
My home is Calgary, Mr. Speaker. Calgary was absolutely brought to its knees by the financial mismanagement of this country and the destruction of the oil and gas industry in 1980. The Liberal National Energy Program was a disaster. The previous Government singled out a number one industry and then raped it. Half of the drilling rigs in western Canada have been idled or they have left the country. People left for a more secure and favourable climate. Those who were left behind went belly-up. The only way to make a buck in the drilling industry is to keep that iron turning.
I invite Hon. Members here today to come out west to the producing provinces. Come out and see the rigs. Come on the floor. See the pipe which is made from the steel from Ontario and the wire cable that is made in Mississauga and the Arctic clothing that comes from Quebec. The survival suits in the Beaufort are made in Vancouver.
As one can see, when the resource industry was so hard halted thousands of jobs were lost all across Canada. The previous Government's energy policy is directly responsible for hundreds of thousands of lost jobs, billions of investment dollars leaving this country and four wasted years in achieving self-sufficiency for Canada.
A PGRT was applied to gross revenues. That is a petroleum and gas revenue tax, where there were no deductions for spending on new exploration and development and no deductions for royalties paid to the provinces. The previous government then revised the corporate income tax. The old earned depletion deduction was eliminated. It then imposed a natural gas and gas liquids tax. It went on and on. In its greed, the Liberal Government heavily taxed this industry. It based its theory on high world oil prices and increased consumption. However, someone forgot to tell that government that one does not budget on anticipation but on hard facts and figures.
We in the oil and gas business need a tremendous lead time to produce. We need 8 to 12 years for geological surveys, for land acquisition and exploration. We need this in order to get development and production. This industry has to find its raw materials first before it can manufacture the product. These

November 29, 1984
Borrowing Authority
are unique circumstances. The up-front capital is high risk and should be treated as a high-risk investment.
I correspond with some 250 members of the Canadian Federation of Independent Business, and small businessmen in my riding on a regular basis. They are desperate to keep their businesses going, let alone expand their capabilities. This means jobs and we cannot foster tomorrow's increased employment until we meet yesterday's obligations.
This is what Bill C-ll is all about. If my hon. friend, the Member for Hamilton East (Ms. Copps), was in the House today, I would ask her to turn back a few pages in history to see what her government did to strangle the resource industry. When that industry turned down, we quit making hole and when we quit making hole we did not need pipe. If we did not need pipe, then we did not need steel from Hamilton. We did not need draw works and we did not need wire cable. In fact, we did not need anything. The unemployment in her riding is directly related to her government.
This Government is committed to giving Canadians a well managed, efficient and productive Government. We promised a major overhaul of planning and budgetary controls and we will produce. There are no easy solutions. Our mandate is huge but we will keep our promises. I want to tell my hon. friends how proud I am to be a member of the House and to have this opportunity to speak in support of Bill C-l 1 today.

",Progressive Conservative,,Barbara Jane (Bobbie) Sparrow,http://www.parl.gc.ca/parlinfo/Files/Parliamentarian.aspx?Item=968a91bc-c011-4025-8441-b63d8599dc05&Language=E&Section=ALL
3498776,ca.proc.d.1984-11-29.1.1.3,1984-11-29,7dcf3dd2-39d7-4162-a494-1c4ca12ab718,ca.m.6145,Mr. Deputy Speaker:,Deputy Speaker and Chair of Committees of the Whole of the House of Commons,GOVERNMENT ORDERS,"BORROWING AUTHORITY ACT, 1984-85 (No. 2) MEASURE TO ENACT",,"Questions and comments?

",Progressive Conservative,,Marcel Danis,http://www.parl.gc.ca/parlinfo/Files/Parliamentarian.aspx?Item=7dcf3dd2-39d7-4162-a494-1c4ca12ab718&Language=E&Section=ALL
3498777,ca.proc.d.1984-11-29.1.1.4,1984-11-29,efec68a7-e1fd-490f-8b6a-95313440440c,ca.m.3358,Mr. Boudria:,,GOVERNMENT ORDERS,"BORROWING AUTHORITY ACT, 1984-85 (No. 2) MEASURE TO ENACT",,"Mr. Speaker, in concluding her remarks, the Hon. Member talked about the promise. Of course, we know that the Government's promise to which she referred was to create tens upon tens of thousands of new jobs in this country as soon as the new Government could be sworn into office.
I am sure that the Hon. Member and the Prime Minister (Mr. Mulroney) recall this statement being made. Could she tell us of the Government's progress in keeping this promise? Specifically, how many tens of thousands of jobs have been cut since the Government came to office, rather than created, as it promised?
MS)

",Liberal,,Don Boudria,http://www.parl.gc.ca/parlinfo/Files/Parliamentarian.aspx?Item=efec68a7-e1fd-490f-8b6a-95313440440c&Language=E&Section=ALL
3498778,ca.proc.d.1984-11-29.1.1.5,1984-11-29,968a91bc-c011-4025-8441-b63d8599dc05,ca.m.4018,Mrs. Sparrow:,,GOVERNMENT ORDERS,"BORROWING AUTHORITY ACT, 1984-85 (No. 2) MEASURE TO ENACT",,"Mr. Speaker, I appreciate my hon. colleague's comments. When we came into office we had no idea what we were facing. The Liberals had 16 years to create this mess and we are going to do our very best to pick up the pieces very slowly and put them in place. We are going to get Canada off its knees and on to its feet and then we are going to run. We are going to give the people of Canada an opportunity to take hold of our resources, be they natural or human resources. We are going to give this country an opportunity to be what it should be.

",Progressive Conservative,,Barbara Jane (Bobbie) Sparrow,http://www.parl.gc.ca/parlinfo/Files/Parliamentarian.aspx?Item=968a91bc-c011-4025-8441-b63d8599dc05&Language=E&Section=ALL
3498779,ca.proc.d.1984-11-29.1.1.6,1984-11-29,efec68a7-e1fd-490f-8b6a-95313440440c,ca.m.3358,Mr. Boudria:,,GOVERNMENT ORDERS,"BORROWING AUTHORITY ACT, 1984-85 (No. 2) MEASURE TO ENACT",,"Mr. Speaker, I have a further comment. The Hon. Member has just told us that her Government did not know what it was doing when it was sworn into office and did not know what was going on. It just did not know where to start doing its job, nor did it know what the books looked like.
It seems that the Tories are the only people who did not know what was going on. We certainly knew-

",Liberal,,Don Boudria,http://www.parl.gc.ca/parlinfo/Files/Parliamentarian.aspx?Item=efec68a7-e1fd-490f-8b6a-95313440440c&Language=E&Section=ALL
3498780,ca.proc.d.1984-11-29.1.1.7,1984-11-29,intervention,,,,GOVERNMENT ORDERS,"BORROWING AUTHORITY ACT, 1984-85 (No. 2) MEASURE TO ENACT",,"Oh, oh!

",,,Some Hon. Members:,
3498781,ca.proc.d.1984-11-29.1.1.8,1984-11-29,intervention,,,,GOVERNMENT ORDERS,"BORROWING AUTHORITY ACT, 1984-85 (No. 2) MEASURE TO ENACT",,"Hear, hear!

",,,Some Hon. Members:,
3498782,ca.proc.d.1984-11-29.1.1.9,1984-11-29,efec68a7-e1fd-490f-8b6a-95313440440c,ca.m.3358,Mr. Boudria:,,GOVERNMENT ORDERS,"BORROWING AUTHORITY ACT, 1984-85 (No. 2) MEASURE TO ENACT",,"Did I hit a tender nerve on the other side, Mr. Speaker? As I was just about to say before I was so rudely interrupted, we certainly knew that we could not make billions of dollars of promises, but we did not make promises with which we could not live. We chose to promise only those things on which we could deliver.

",Liberal,,Don Boudria,http://www.parl.gc.ca/parlinfo/Files/Parliamentarian.aspx?Item=efec68a7-e1fd-490f-8b6a-95313440440c&Language=E&Section=ALL
3498783,ca.proc.d.1984-11-29.1.1.10,1984-11-29,1ff3d0ab-f0ae-4f2f-8554-fe0f6f03c903,ca.m.4778,Mr. Stewart:,,GOVERNMENT ORDERS,"BORROWING AUTHORITY ACT, 1984-85 (No. 2) MEASURE TO ENACT",,"That is why you have 40 seats over there.

",Liberal,,John B. Stewart,http://www.parl.gc.ca/parlinfo/Files/Parliamentarian.aspx?Item=1ff3d0ab-f0ae-4f2f-8554-fe0f6f03c903&Language=E&Section=ALL
3498784,ca.proc.d.1984-11-29.1.1.11,1984-11-29,efec68a7-e1fd-490f-8b6a-95313440440c,ca.m.3358,Mr. Boudria:,,GOVERNMENT ORDERS,"BORROWING AUTHORITY ACT, 1984-85 (No. 2) MEASURE TO ENACT",,"That may be why we got 40 seats, but we still have our honour.

",Liberal,,Don Boudria,http://www.parl.gc.ca/parlinfo/Files/Parliamentarian.aspx?Item=efec68a7-e1fd-490f-8b6a-95313440440c&Language=E&Section=ALL
3498785,ca.proc.d.1984-11-29.1.1.12,1984-11-29,intervention,,,,GOVERNMENT ORDERS,"BORROWING AUTHORITY ACT, 1984-85 (No. 2) MEASURE TO ENACT",,"Oh, oh!

",,,Some Hon. Members:,
3498786,ca.proc.d.1984-11-29.1.1.13,1984-11-29,efec68a7-e1fd-490f-8b6a-95313440440c,ca.m.3358,Mr. Boudria:,,GOVERNMENT ORDERS,"BORROWING AUTHORITY ACT, 1984-85 (No. 2) MEASURE TO ENACT",,"At least when we get back into power we will be able to deliver on those things we promised. We will not disappoint the people of this country, such as this Government has done since it has assumed office. They are right, Mr. Speaker, they did not know what was going on. They still do not know what is going on. They promised tens upon tens of thousands of jobs.
In this book that I have in my hand entitled ""Expenditure Review"", the Government has cut thousands of jobs from my riding right here in the Ottawa area as well as in the ridings of several Hon. Members. I see the Hon. Member for Gatineau (Mrs. Mailly). Maybe she could stand up and comment on the thousands of jobs cut in her constituency. None has been created but thousands have been cut. That is the disappointing record of this Government so far. We had enough of a similar government not long ago after nine months. We have had enough of this one after two months.

",Liberal,,Don Boudria,http://www.parl.gc.ca/parlinfo/Files/Parliamentarian.aspx?Item=efec68a7-e1fd-490f-8b6a-95313440440c&Language=E&Section=ALL
3498787,ca.proc.d.1984-11-29.1.1.14,1984-11-29,968a91bc-c011-4025-8441-b63d8599dc05,ca.m.4018,Mrs. Sparrow:,,GOVERNMENT ORDERS,"BORROWING AUTHORITY ACT, 1984-85 (No. 2) MEASURE TO ENACT",,"Mr. Speaker, I would like to ask my colleague-

",Progressive Conservative,,Barbara Jane (Bobbie) Sparrow,http://www.parl.gc.ca/parlinfo/Files/Parliamentarian.aspx?Item=968a91bc-c011-4025-8441-b63d8599dc05&Language=E&Section=ALL
3498788,ca.proc.d.1984-11-29.1.1.15,1984-11-29,efec68a7-e1fd-490f-8b6a-95313440440c,ca.m.3358,Mr. Boudria:,,GOVERNMENT ORDERS,"BORROWING AUTHORITY ACT, 1984-85 (No. 2) MEASURE TO ENACT",,"You can't ask. I ask.

",Liberal,,Don Boudria,http://www.parl.gc.ca/parlinfo/Files/Parliamentarian.aspx?Item=efec68a7-e1fd-490f-8b6a-95313440440c&Language=E&Section=ALL
3498789,ca.proc.d.1984-11-29.1.1.16,1984-11-29,968a91bc-c011-4025-8441-b63d8599dc05,ca.m.4018,Mrs. Sparrow:,,GOVERNMENT ORDERS,"BORROWING AUTHORITY ACT, 1984-85 (No. 2) MEASURE TO ENACT",,"Let me make a suggestion to my colleague, Mr. Speaker. Did the Hon. Member know he was giving us a $34 billion deficit?

",Progressive Conservative,,Barbara Jane (Bobbie) Sparrow,http://www.parl.gc.ca/parlinfo/Files/Parliamentarian.aspx?Item=968a91bc-c011-4025-8441-b63d8599dc05&Language=E&Section=ALL
3498790,ca.proc.d.1984-11-29.1.1.17,1984-11-29,intervention,,,,GOVERNMENT ORDERS,"BORROWING AUTHORITY ACT, 1984-85 (No. 2) MEASURE TO ENACT",,"Is that one of the promises?

",,,An Hon. Member:,
3498791,ca.proc.d.1984-11-29.1.1.18,1984-11-29,968a91bc-c011-4025-8441-b63d8599dc05,ca.m.4018,Mrs. Sparrow:,,GOVERNMENT ORDERS,"BORROWING AUTHORITY ACT, 1984-85 (No. 2) MEASURE TO ENACT",,"It started at $29 billion. I believe it was the finance minister in the previous government who made a miscalculation of maybe $5 billion.
I would like to tell the Hon. Member that we have been given a tremendous mandate. We have been handed a problem. We are very unhappy with our problem but we are going to work slowly and surely and we will get tens of thousands of people back to work. Already the Minister of Energy, Mines and Resources (Miss Carney) is working very closely with the provinces and with the industry on a new national energy
November 29, 1984

program. We will develop that. We are working in the agricultural area. Yes, Mr. Speaker, people will see in the next four years that we will stand by our promises and we will meet them.

",Progressive Conservative,,Barbara Jane (Bobbie) Sparrow,http://www.parl.gc.ca/parlinfo/Files/Parliamentarian.aspx?Item=968a91bc-c011-4025-8441-b63d8599dc05&Language=E&Section=ALL
3498792,ca.proc.d.1984-11-29.1.1.19,1984-11-29,intervention,,,,GOVERNMENT ORDERS,"BORROWING AUTHORITY ACT, 1984-85 (No. 2) MEASURE TO ENACT",,"Hear, hear!

",,,Some Hon. Members:,
3498793,ca.proc.d.1984-11-29.1.1.20,1984-11-29,7dcf3dd2-39d7-4162-a494-1c4ca12ab718,ca.m.6145,Mr. Deputy Speaker:,Deputy Speaker and Chair of Committees of the Whole of the House of Commons,GOVERNMENT ORDERS,"BORROWING AUTHORITY ACT, 1984-85 (No. 2) MEASURE TO ENACT",,"The Hon. Member for Gatineau (Mrs. Mailly), on questions or comments.

",Progressive Conservative,,Marcel Danis,http://www.parl.gc.ca/parlinfo/Files/Parliamentarian.aspx?Item=7dcf3dd2-39d7-4162-a494-1c4ca12ab718&Language=E&Section=ALL
3498794,ca.proc.d.1984-11-29.1.1.21,1984-11-29,6e5413d2-86d6-45a6-8b56-91e4d8653734,ca.m.4515,Mrs. Mailly:,Chief Government Whip's assistant; Deputy Whip of the Progressive Conservative Party,GOVERNMENT ORDERS,"BORROWING AUTHORITY ACT, 1984-85 (No. 2) MEASURE TO ENACT",,"Yes, Mr. Speaker. I have a comment on one made by my hon. colleague. He said that in my riding-

",Progressive Conservative,,Claudy Mailly,http://www.parl.gc.ca/parlinfo/Files/Parliamentarian.aspx?Item=6e5413d2-86d6-45a6-8b56-91e4d8653734&Language=E&Section=ALL
3498795,ca.proc.d.1984-11-29.1.1.22,1984-11-29,7dcf3dd2-39d7-4162-a494-1c4ca12ab718,ca.m.6145,Mr. Deputy Speaker:,Deputy Speaker and Chair of Committees of the Whole of the House of Commons,GOVERNMENT ORDERS,"BORROWING AUTHORITY ACT, 1984-85 (No. 2) MEASURE TO ENACT",,"l would remind the Hon. Member that questions and comments are to be addressed to the speech made by the Member for Calgary South (Mrs. Sparrow) and not to the Hon. Member who made the other comment.

",Progressive Conservative,,Marcel Danis,http://www.parl.gc.ca/parlinfo/Files/Parliamentarian.aspx?Item=7dcf3dd2-39d7-4162-a494-1c4ca12ab718&Language=E&Section=ALL
3498796,ca.proc.d.1984-11-29.1.1.23,1984-11-29,6e5413d2-86d6-45a6-8b56-91e4d8653734,ca.m.4515,Mrs. Mailly:,Chief Government Whip's assistant; Deputy Whip of the Progressive Conservative Party,GOVERNMENT ORDERS,"BORROWING AUTHORITY ACT, 1984-85 (No. 2) MEASURE TO ENACT",,"Mr. Speaker, I would like to direct my comments to the Hon. Member for Calgary South (Mrs. Sparrow) and congratulate her on her realistic approach and on having had the patience to listen to the nonsense of the Hon. Member sitting nearby, who said we had not created any jobs. Since September 17 of this year, we have created 34,000 jobs in this country. 1 can assure my hon. colleague from Calgary South that she was right when she said we have already created a climate favourable to employment. In my riding, where factories were in great trouble as a result of neglect on the part of the previous administration, thanks to the initiative and imaginative approach of Gatineau workers, we are now reopening factories that had been closed down.
The Hon. Member is correct in saying that out West they are drilling oil wells with Ontario steel and the talents and human resources of Quebec and Gatineau, because 1 know that, as far as my riding is concerned, we have people who are working out West. Many lost their jobs over the last three years, that is true, but fortunately, a number of people are still working in Western Canada.
1 know that thanks to efforts of our Government and the negotiating and conciliatory skills of our Minister of Energy, Mines and Resources (Mrs. Carney), there will very soon be a considerable activity in the West. Canadian oil will be produced by Canadians, consumed by Canadians and used to help develop Canada's resources, and this will be done by Canadian companies, not like what happened in the past, when jobs were exported because they were buying out foreign companies and sending billions of dollars to Belgium and buying oil from other countries because the administration here in Canada did not have the political or moral courage to face up to its responsibilities.
Borrowing Authority

",Progressive Conservative,,Claudy Mailly,http://www.parl.gc.ca/parlinfo/Files/Parliamentarian.aspx?Item=6e5413d2-86d6-45a6-8b56-91e4d8653734&Language=E&Section=ALL
3498797,ca.proc.d.1984-11-29.1.1.24,1984-11-29,d835e98c-fbf2-40ec-addb-13d13d6ffad6,ca.m.9000,Mr. Brisco:,,GOVERNMENT ORDERS,"BORROWING AUTHORITY ACT, 1984-85 (No. 2) MEASURE TO ENACT",,"Mr. Speaker, I should like to add some comments which would have unquestionably been made by the Hon. Member for Calgary South (Mrs. Sparrow). Given the constraints on her address, there are other matters which we should introduce into this discussion or into this debate.
The challenge has been made that this Government has not acted on anything. What a facile challenge; what a simple one to respond to! 1 recall the Liberal Minister responsible for the Canadian Wheat Board delaying for two months making payments to the wheat stabilization board, simply because he did not know where he was supposed to sign the cheque. We did that immediately. We froze Seaway tolls immediately. We froze the abandonment of rail lines, which guarantees and ensures that farmers in western Canada have an opportunity to get their wheat on rail. We froze the rail abandonment in my constituency, which is in the forest sector, to ensure that the mills could get their lumber to overseas markets. Those were the kinds of initiatives which were taken immediately. Also we took a very interesting initiative about which I am very happy. It was the initiative to relieve members of the Liberal Party of their seats in the House of Commons.
It is true that the Hon. Member for Calgary South did not have an opportunity to make that suggestion to the Hon. Member for Glengarry-Prescott-Russell (Mr. Boudria). Nevertheless, contingent upon that defeat of these people who had not been serving Canadians the way they wanted to be served was a number of employment opportunities which the Liberals themselves had created. Those opportunities without direct address to the intelligence, the capability and the area of endeavour of individuals have now been terminated. I think that is most appropriate.

",Progressive Conservative,,Robert Hylton Brisco,http://www.parl.gc.ca/parlinfo/Files/Parliamentarian.aspx?Item=d835e98c-fbf2-40ec-addb-13d13d6ffad6&Language=E&Section=ALL
3498798,ca.proc.d.1984-11-29.1.1.25,1984-11-29,5fd68b94-0c72-4ac3-a336-e9302792c3c8,ca.m.8137,Mr. Simon de Jong (Regina East):,,GOVERNMENT ORDERS,"BORROWING AUTHORITY ACT, 1984-85 (No. 2) MEASURE TO ENACT",,"Mr. Speaker, in some ways I experience deja vu entering the debate on the borrowing Bill, the request of the Government to borrow some $23 billion. I have heard these types of debates before. The actors have changed but the lines remain the same. When the Conservatives were in opposition and the Liberals were in government, very often I heard the lines which are being delivered by Conservative members today being delivered by Liberal members. We hear Liberal members today giving the lines that the Conservative members used to deliver. The actors have changed, but the lines surely remain the same.

",New Democratic Party,,Simon Leendert de Jong,http://www.parl.gc.ca/parlinfo/Files/Parliamentarian.aspx?Item=5fd68b94-0c72-4ac3-a336-e9302792c3c8&Language=E&Section=ALL
3498799,ca.proc.d.1984-11-29.1.1.26,1984-11-29,intervention,,,,GOVERNMENT ORDERS,"BORROWING AUTHORITY ACT, 1984-85 (No. 2) MEASURE TO ENACT",,"Nonsense.

",,,An Hon. Member:,
