basepk,hid,speechdate,pid,opid,speakeroldname,speakerposition,maintopic,subtopic,subsubtopic,speechtext,speakerparty,speakerriding,speakername,speakerurl
3494471,ca.proc.d.1984-11-13.1,1984-11-13,,,,topic,SPEECH FROM THE THRONE,,,,,,,
3494472,ca.proc.d.1984-11-13.1.1,1984-11-13,,,,subtopic,SPEECH FROM THE THRONE,RESUMPTION OF DEBATE ON ADDRESS IN REPLY,,,,,,
3494473,ca.proc.d.1984-11-13.1.1.1.1,1984-11-13,,,,stagedirection,,,,"The House resumed from Friday, November 9, consideration of the motion of Mr. Ken James for an Address to Her Excellency the Governor General in reply to her Speech at the opening of the session; and the amendment thereto of Mr. Turner (Vancouver Quadra) (p. 38).",,,,
3494474,ca.proc.d.1984-11-13.1.1.2,1984-11-13,3305c3e7-c8cf-4757-ac27-52fdd4b496a6,ca.m.5235,Mr. Alfonso Gagliano (Saint-Leonard-Anjou):,,SPEECH FROM THE THRONE,RESUMPTION OF DEBATE ON ADDRESS IN REPLY,,"Mr. Speaker, thank you for recognizing me on this occasion, my first address to the House of Commons. I would like to congratulate you on your election to a role in which you will surely excel. As one of the most junior Members, I would also like to extend my best wishes to the most senior Parliamentarian, the Hon. Stanley Knowles. Mr. Speaker, you will undoubtedly find him to be a great source of wisdom.

Mr. Speaker, it is a great privilege for me to address this august assembly, and I wish to thank the people of Saint-Leonard-Anjou for electing me as their Member and giving me the honour of representing them in this Chamber.
My riding, located on the eastern part of Montreal Island, consists of two towns, Saint-Leonard and Anjou, and part of the parish of Saint-Rene Goupil. Saint-Leonard has a population of over 70,000, of whom 40,000 are French speaking, 25,000 Italian speaking, 8,000 English speaking and 5,000 of other origins, including many Haitians. In Anjou, the vast majority of the population, 36,000, is French speaking, followed by 3,000 Anglophones and 1,500 residents of various origins. The riding also includes about 5,000 residents of Saint-Rene Goupil.

It is particularly exciting to represent such a diverse and truly multicultural riding. It is principally residential but it also contains the important industrial parks of Saint-Leonard and Anjou. Both of these industrial parks contain a broad sample of that most vital part of our economy, small business. [Translation]
In 1963, our municipalities were small towns without any real economic infrastructure. In twenty-one years, thanks to Liberal legislation which promoted business development, we have been able to achieve a level of economic growth seldom equalled in Canada. By dint of hard work, diligence and
intelligent planning, our small and medium-sized businesses have made the riding of Saint-Leonard-Anjou a major commercial and industrial area.

While I am on the subject of Saint-Leonard-Anjou, which I am very proud to represent, let me say how honoured I am to succeed the Hon. Monique Begin as its Member of Parliament. It is no small task to try to follow her example. She was such a bright and compassionate person, one who worked so hard to improve the lifestyle of disadvantaged Canadians.

An exceptional Member of Parliament, she remained close to the concerns of her fellow Canadians, while at the same time developing a vision of the realities of this country. She is one of those remarkable people who have had a profound influence on Canada, both through the legislation that was adopted by Parliament and her contribution to the social evolution of our country. Without her, this country would not have become what it is today: a modern and dynamic country, with a concern for social justice and able to provide health services that are the envy of the rest of the world.

I join with my constituents in thanking her for the 12 years she worked for the riding. I will try my hardest to maintain the standard of service which she set.

Mr. Speaker, I pointed out earlier the major role played by small businesses in my riding. Thanks to these businesses and to the assistance provided by the previous Government, Canada has one of the highest job creation rates in the industrialized world. Our small businesses certainly deserve to be praised for their role in the present economic recovery.

Small businesses, from corner grocery stores to microchip manufacturers, from tailor shops to machine shops, can create more real jobs faster than any other sector of the economy. In light of this, I was pleased to hear on Monday that the Government intends to enhance risk taking and to reward entrepreneurs. That is good, but it would be better to know how it will be done.

Confidence is said to be a wonder drug. However, if the government wants to restore confidence, it ought to follow a realistic and constructive rather than an ambiguous approach. Canadians are impatiently waiting for specifics.

November 13, 1984
The Address-Mr. Gagliano
Referring to the correctional system, the government stated, and I quote, Mr. Speaker:
But it is obvious that there are grave defects in the system and my government accepts its responsibility to rectify these quickly.
Well, Mr. Speaker, it is now up to the government to accept the responsibilities set forth during the electoral campaign and to begin to deliver on its promises, including those which it forgot to include in the Speech from the Throne.
The government proudly and rightfully talks about its mandate as if it were an excellent opportunity. Mr. Speaker, it is an excellent opportunity to suggest concrete solutions instead of making empty speeches as they have been doing so far.
According to the polls, the majority achieved by the Conservatives reflected a desire for change, not a miraculous conversion to the Conservative Party. The Progressive Conservative government has a very clear mandate to take action. It has a mandate to keep its promises, for indeed they were very generous and even impossible promises. One could even say that they were irresponsible promises.
Mr. Speaker, the government stated that the answer to all the problems of this country lies in consensus, and I quote:
A national consensus is also needed to reduce the persistent isolation of Canada's regions, to meet the challenges of economic and social disparity, to revitalize the strength of our traditional resource industries, such as agriculture, forestry, mining, the fishery and tourism, and to ensure that our critical transportation and communication links better serve the national purpose.
To me, those are pious wishes. A national consensus, but what about? And on what? We have yet to hear practical suggestions which might lead to a consensus. A national consensus! Would problems disappear as if by magic so that the government will not have to solve them? And then we are told, and I quote:
Future summits could address in more details issues such as the enhancement of productivity, and the responsibilities of industry, labour and government in training and technology.
Those are important issues which are put on the back burner, Mr. Speaker, such as the tens of thousands of jobs which were to be created the moment the new Cabinet was sworn to office.
The vocabulary of the Government is full of expressions showing it is in no hurry, expressions like ""over time"" and ""following extensive consultations"". I hope it does not substitute ""lengthy"" consultations for ""extensive"" consultations. Where is all the work that the famous Tory transition team is supposed to have accomplished? Why were there no new and solid policy proposals in the Throne Speech?
We heard during the campaign that with the swearing in of the Cabinet tens of thousands of jobs would be created. In the absence of any substance to that blarney, we could have at least expected there would be legislation to reduce unemployment; but no, instead of ""jobs, jobs, jobs"" we hear those heroic
Tory buzz words ""study, consultation and consensus"". Will the words ""some time in the future"" cure the unemployment problem?

Mr. Speaker, I admit that some initiatives were taken last Monday, but they did not come from the Progressive Conservatives since they did nothing more than implement the initiatives of the previous government. For instance, deletion of discriminatory provisions in the Indian Act, repression of pornography, assistance to victims of family violence, and resumption of discussions on pension reform already launched by the Liberals. The government might claim to have some credibility if it had been able to fulfil the expectations of Canadians by implementing its own policies as a substitute for the Liberal policies it has adopted.

As for the meagre Tory input of the cure-all ""consultation, mediation, co-operation, consensus"" and above all ""confidence"", well, they are very slick buzz words but are a poor substitute for the type of credible and concrete prospects required to generate real confidence.

After the hue and cry raised against the problems created by the previous government, it is comforting, Mr. Speaker, to see that Liberal policies did make sense after all.
MS)

We all know, Mr. Speaker, that imitation is the highest form of flattery.

We thank them for the compliment.

",Liberal,,Alfonso Gagliano,http://www.parl.gc.ca/parlinfo/Files/Parliamentarian.aspx?Item=3305c3e7-c8cf-4757-ac27-52fdd4b496a6&Language=E&Section=ALL
3494475,ca.proc.d.1984-11-13.1.1.3,1984-11-13,7dcf3dd2-39d7-4162-a494-1c4ca12ab718,ca.m.6145,Mr. Deputy Speaker:,Deputy Speaker and Chair of Committees of the Whole of the House of Commons,SPEECH FROM THE THRONE,RESUMPTION OF DEBATE ON ADDRESS IN REPLY,,"Are there questions or comments? We shall then proceed with debate.

",Progressive Conservative,,Marcel Danis,http://www.parl.gc.ca/parlinfo/Files/Parliamentarian.aspx?Item=7dcf3dd2-39d7-4162-a494-1c4ca12ab718&Language=E&Section=ALL
