basepk,hid,speechdate,pid,opid,speakeroldname,speakerposition,maintopic,subtopic,subsubtopic,speechtext,speakerparty,speakerriding,speakername,speakerurl
3494505,ca.proc.d.1984-11-13.1.1.33,1984-11-13,04c88469-fd47-40e9-b8ad-fbb8a173dcb9,ca.m.2678,Mr. Foster:,,SPEECH FROM THE THRONE,RESUMPTION OF DEBATE ON ADDRESS IN REPLY,,"-while he increases his staff allocation by $140,000. We see the Job Training Options Program announced to take place some time next spring which will create some 2,000 or 4,000 jobs, whereas the First Chance Program, which I understand was a similar kind of program, was supposed to begin on October 1 and by contrast would have created 26,000 jobs.
In the economic statement that we had last week there were massive cuts in financial activity by the federal Government, but we are not actually going to see a budget until some time next spring. The economic statement told us how the Government was going to make massive cuts in its expenditure, but it did not tell us how the Government was going to create the tens of thousands of jobs which were promised last July in Prince Albert. The headlines of the last three days pretty well spell out the impact of that economic statement. The Globe and Mail carried the headline ""Government Focuses on Deficit Reduction, not Jobs"". An editorial in The Toronto Star was headlined ""Abandoning the Jobless"". ""PM Changes Stand on Social Programs"", in The Globe and Mail. ""Reversal of policy squeezes the Department of National Defence"" in The Globe and Mail. The headlines ""Dewar to Protest Housing Fund Cut"", and ""50,000 Jobs Price of Tory Cuts"", both appeared in the Ottawa Citizen. ""Social Welfare Advocates decry cuts in UIC and Job Training"". ""Tory Squeeze on Youth Outrages Student Leaders"". ""Gasoline to go up 2.5 Cents a Litre"". Does anyone remember the Prime Minister promising anything in the election campaign that would lead us to believe that we would see headlines like these this first weekend after the opening of the new Parliament? Does anyone believe that the Canadian electorate will ever believe the Tory promises again? I doubt that even Tories will believe Tory promises in the future.
What happens when we bring these massive cuts and national headlines down to the constituency level? That is really where the action is. A ten-cent a gallon increase in gasoline probably means that the commuting worker at the Elliot Lake uranium mines or at Algoma Steel in Sault Ste. Marie is going to pay something over $100 a year more for his gasoline. The Government cut out the Summer Canada Program. Well, $85 million does not mean much perhaps at the national level, but for 500 or 600 students it means they will have that much less money to spend to go back to school next fall.
An increase in marina fees and the cutting out of the mobile surveillance group for customs means that tourism will be hit hard in my area. The cutting of the Canadian Oil Substitution

November 13, 1984
The Address-Mr. Foster
Program, CHIP and RRAP will mean that low-income families, many of them senior citizens, will not be able to carry out repairs to their homes. They will have to go and see their bank manager instead. The cutback of $200 million in the Industrial Regional Development Program will harm the attraction of new industries to cities like Sault Ste. Marie and northern areas of our country. Toughening up the qualifications for unemployment insurance benefits will push low-income families into welfare that much sooner. Job training programs are to be cut by $128 million so that people cannot be retrained for new jobs when they lose their old ones.
These are cruel and tough measures for the slow growth areas and the low income parts of our country. Cities like Sault Ste. Marie, which has been wracked by recession since the world-wide recession two and one-half years ago, will need more help this winter rather than less, which is what they will get. If the Prime Minister and the Minister of Finance had told the Canadian people during the election campaign last summer what their secret agenda was to be, the result of that election would have been different. They certainly would not have received the support of 50 per cent of the Canadian people. They certainly would not have gotten 75 per cent of the seats in the House of Commons. Surely, Mr. Speaker, this is the kind of change in promises which make people so cynical of politicians.
As well as not keeping its promises, with no advance warning in the election campaign, the Government has reduced many vital services to Canadians. The most frightening aspect of this, Mr. Speaker, is that this is not the end of the Tory ""chop chop show"". It is probably only the beginning. Our social security system was a sacred trust in the last election. Now it is something to be chopped and negotiated away. We will just have to stand by and see what is proposed for our Old Age Security pension program and our family allowance program which will come under the Tory cutting machine next spring when the budget comes out. Surely no one will believe these kinds of election promises again.
I would like to speak briefly about agriculture today because there is no sector of our economy which requires more attention than this industry at this time. It was mentioned only once in the Speech from the Throne and there were only a couple of proposals and a massive cut of $63 million with regard to it in the economic statement.
Agri-bonds, Section 31 of the Income Tax Act and capital gains are to be referred to a committee of Parliament. Mr. Speaker, I believe that it is the role of government to propose legislation and the role of the Parliament of Canada to dispose of that legislation . This Government seems to be asking us to do endless studies rather than putting forth concrete proposals to be dealt with in the form of legislation.
Canagrex is to be wound up to save the Government $6.6 million. The Tory policy talks about Canada being a superpower and increasing exports massively. How do we increase
exports massively if we cut out this most important exporting arm of Agriculture Canada?
Agricultural research was to be increased, Mr. Speaker. Now we discover that it is to be cut by $2.7 million and that laboratory projects are to be deferred. Farmers were to be able to write their loans down to current day values and the special Farm Financing Assistance Program was to be reinstated. There was nary a word in the economic statement or in the Speech from the Throne about that. Agricultural service fees charged by the federal Government will be increased by $32 million. Some of these are bound to end up in farmers' costs.
There is a crisis in the agricultural industry today with regard to grains, red meats and other sectors. The Agriculture Canada report of mid-summer projects that farm net incomes will drop by 3 per cent across the country this year. In Saskatchewan this projection has increased to 8.9 per cent and to 35.5 per cent in Manitoba. Where is the action to overcome this problem? Grain exports are projected to fall by 25 per cent in the 1984-85 crop year. The value of those exports could drop from the $5.5 billion of last year to $3 billion in this coming crop year, according to the Wheat Board. The red meat industry is likewise facing low commodity prices, higher input costs and stiff competition, such as the imports from Ireland which are subsidized to the extent of some 40 cents a pound.
Already this year farm bankruptcies are up by 25 per cent. The Farm Credit Corporation reports that 39,000 farmers are severely stressed financially and that up to 1,700 could face imminent financial collapse due to the heavy debt load. Where is the action in the Speech from the Throne and the economic statement to solve these problems?
The Government promised lower interest rates to be written down by the Farm Credit Corporation or other lenders. There were no proposals put forward in that regard. Where are the review panels which could prevent bankruptcies and provide arbitration such as that which was proposed in Bill C-17 in the Thirty-second Parliament? Why is there no action in the Speech from the Throne to block subsidized beef coming in from Ireland? Why is there no mention of a marketing program or stabilization system to improve returns to the red meat industry? Why is there no action proposed in the Speech from the Throne to set aside debt for those good producers who, in normal times, would have a viable agricultural industry?
I hope that the Minister of Agriculture (Mr. Wise) will be putting forward a proposal such as was made in the United States in mid-September. Why is there no action to make amendments to the Western Grain Stabilization Fund to have a special payout of $500 million this year as was proposed by the former Prime Minister? That fund is made up of farmers' money and the returns and market opportunities are drastically reduced this year. That is the sort of action which should have been in the Speech from the Throne or the economic statement.
The Government has proposed practically nothing in the Speech from the Throne to solve the emergency situations
November 13, 1984

facing several sectors of the agricultural community today. The initiative for legislation in the House must come from the Government. Parliament cannot act to solve these problems with legislation or budgetary items which are not before it. Unless there is some action the situation will grow even more acute throughout the winter and spring months and we will see bankruptcies rise to the level projected by the Farm Credit Corporation. Mr. Speaker, there should have been action on these items in the Speech from the Throne or in the economic statement.
The figure projected by the Farm Credit Corporation of 1,000 or 1,700 bankruptcies is not just an empty statistic. It represents farms and farm families. It represents hopes and dreams which will be destroyed unless the Government acts in this first session of the Thirty-third Parliament.

",Liberal,,Maurice Brydon Foster,http://www.parl.gc.ca/parlinfo/Files/Parliamentarian.aspx?Item=04c88469-fd47-40e9-b8ad-fbb8a173dcb9&Language=E&Section=ALL
3494506,ca.proc.d.1984-11-13.1.1.34,1984-11-13,7dcf3dd2-39d7-4162-a494-1c4ca12ab718,ca.m.6145,Mr. Deputy Speaker:,Deputy Speaker and Chair of Committees of the Whole of the House of Commons,SPEECH FROM THE THRONE,RESUMPTION OF DEBATE ON ADDRESS IN REPLY,,"Are there any questions or comments?

",Progressive Conservative,,Marcel Danis,http://www.parl.gc.ca/parlinfo/Files/Parliamentarian.aspx?Item=7dcf3dd2-39d7-4162-a494-1c4ca12ab718&Language=E&Section=ALL
3494507,ca.proc.d.1984-11-13.1.1.35,1984-11-13,73f3f1af-58df-4cf2-95e5-958209b05366,ca.m.5429,Mr. MacDougall:,,SPEECH FROM THE THRONE,RESUMPTION OF DEBATE ON ADDRESS IN REPLY,,"Mr. Speaker, I would first like to congratulate the Hon. Member for Algoma (Mr. Foster), one of the few Members on the other side who returned to the House after the election.
I marvel at the Hon. Member for Algoma expecting us on this side, after a matter of two months, to be able to address all the problems which the prior government caused in the country. Would the Member for Algoma tell us whether he himself or his Party is in favour of pensions and baby bonuses for those in Canada who are making over $100,000 a year? Is he himself or his Party in favour of having individuals in that wage category receive that type of benefit?

",Progressive Conservative,,John Alexander Frances MacDougall,http://www.parl.gc.ca/parlinfo/Files/Parliamentarian.aspx?Item=73f3f1af-58df-4cf2-95e5-958209b05366&Language=E&Section=ALL
3494508,ca.proc.d.1984-11-13.1.1.36,1984-11-13,04c88469-fd47-40e9-b8ad-fbb8a173dcb9,ca.m.2678,Mr. Foster:,,SPEECH FROM THE THRONE,RESUMPTION OF DEBATE ON ADDRESS IN REPLY,,"Mr. Speaker, what we really marvel at is the change in what the Prime Minister was saying in the election campaign. At that time he said that these programs were a sacred trust and were untouchable. Suddenly they are no longer a sacred trust; apparently only medicare is a sacred trust. We marvel at the undoubted change that has occurred during the last two or three months.

",Liberal,,Maurice Brydon Foster,http://www.parl.gc.ca/parlinfo/Files/Parliamentarian.aspx?Item=04c88469-fd47-40e9-b8ad-fbb8a173dcb9&Language=E&Section=ALL
3494509,ca.proc.d.1984-11-13.1.1.37,1984-11-13,f6e5da54-c9c9-4020-9356-e92606d6b6c4,ca.m.4332,Mr. Baker:,,SPEECH FROM THE THRONE,RESUMPTION OF DEBATE ON ADDRESS IN REPLY,,"Mr. Speaker, let me congratulate the Hon. Member on his speech. However, I think he made one unintentional error with respect to the Summer Canada Program. He said that some 500 or 600 students would lose their jobs during the summer. Would the Hon. Member correct that statement? Perhaps this figure only applies to his riding, because it is an $85 million program. At approximately $1,000 per student, it represents 80,000 students.
Could the Hon. Member give his opinion as to the rationale of a government that would discontinue direct job creation for students in high unemployment areas such as the Hon. Member's riding? What kind of wicked, cruel rationale would a government follow to take such a move? Does he think that the Government will have to turn around in the spring, reverse that policy and bring back the exact same program that the Liberal Government had last summer?
The Address-Mr. Foster

",Liberal,,George Baker,http://www.parl.gc.ca/parlinfo/Files/Parliamentarian.aspx?Item=f6e5da54-c9c9-4020-9356-e92606d6b6c4&Language=E&Section=ALL
3494510,ca.proc.d.1984-11-13.1.1.38,1984-11-13,04c88469-fd47-40e9-b8ad-fbb8a173dcb9,ca.m.2678,Mr. Foster:,,SPEECH FROM THE THRONE,RESUMPTION OF DEBATE ON ADDRESS IN REPLY,,"Mr. Speaker, let me clarify for the Hon. Member that it was 500 or 600 jobs in the Algoma-Manitoulin area and not the whole country. Those jobs will be sorely missed. Many of these students are from low-income families and many are native students from the 12 reserves in my constituency. Many of them have an opportunity to go to university in spite of their modest backgrounds, but they will not now have that opportunity.
Many communities depend on students for their tourism promotion, community betterment, recreational programs and many other projects which the municipal governments cannot afford. They depend on this Summer Canada Program.
I would not attempt to explain the rationale of the Government for cutting out this program. If I were to speculate, I would speculate that the hue and cry from students across the country, including those from constituencies of Members on all sides, will be so great by the spring that the program will be reinstated. This is a relatively modest expenditure and if my constituency is a typical example, it seems to be a cruel, unfair and unjust action to put 500 or 600 students into idleness and to foreclose on their opportunities to return to college or university. I certainly hope that the Government will reverse its policy with respect to this program. It gave no forewarning during the election campaign that it was planning to cut out the student program.
It would have been interesting to see how Progressive Conservative Members would have campaigned on that policy of cutting out student employment programs. I would have been interested to see what support such a policy would have had from the young Progressive Conservatives.
I welcome the question from the Hon. Member from Newfoundland because I did not go into any of the detail which his question allowed me to give in this debate.

",Liberal,,Maurice Brydon Foster,http://www.parl.gc.ca/parlinfo/Files/Parliamentarian.aspx?Item=04c88469-fd47-40e9-b8ad-fbb8a173dcb9&Language=E&Section=ALL
3494511,ca.proc.d.1984-11-13.1.1.39,1984-11-13,251c8921-f8f2-47ca-86da-2fa40e7df4d6,ca.m.5013,Mr. Nickerson:,,SPEECH FROM THE THRONE,RESUMPTION OF DEBATE ON ADDRESS IN REPLY,,"Mr. Speaker, thank you for giving me the opportunity to set the record straight. In his presentation the Hon. Member for Algoma (Mr. Foster) said that Revenue Canada had ceased to give advance rulings on the tax consequences of certain arrangements. This is not the case. Revenue Canada continues to give those advance rulings, with one particular exception. That is the one with which the Hon. Member is concerned. It involves the use of a limited partnership for purposes that were not contemplated under the Income Tax Act.
According to the Act, limited partnership contemplated individuals forming partnerships. In the case with which the Hon. Member is concerned, there are two large corporations that would like to form a limited partnership. That is why an advance ruling has not yet been given in this particular instance.
However, I would agree with the Hon. Member that it would be advantageous, especially for the potential new employees in his riding, were the Department of National Revenue to be able to give that advance ruling in the near future.

November 13, 1984
The Address-Mr. Darling

",Progressive Conservative,,Dave Nickerson,http://www.parl.gc.ca/parlinfo/Files/Parliamentarian.aspx?Item=251c8921-f8f2-47ca-86da-2fa40e7df4d6&Language=E&Section=ALL
3494512,ca.proc.d.1984-11-13.1.1.40,1984-11-13,04c88469-fd47-40e9-b8ad-fbb8a173dcb9,ca.m.2678,Mr. Foster:,,SPEECH FROM THE THRONE,RESUMPTION OF DEBATE ON ADDRESS IN REPLY,,"Mr. Speaker, I mentioned this because I think it is a very important concept. The Government said that it would give greater security, confidence and certainty to the business community. In my opinion, the decision not to allow the implications of a joint venture on a limited partnership only adds uncertainty to the situation. I suggest that it is really a cop-out.
Apparently there were eight such cases before the Department of National Revenue. Two of them, Algoma Steel and Tembec, would create substantial jobs. We are talking about 700 jobs in the case of Algoma Steel. Algoma Steel wanted to form a joint venture or limited partnership in which some of the tax credits and capital cost allowances of the corporation would be used by another corporation under a limited partnership. This would mean 700 permanent jobs that are desperately needed in our own area.
I understand that a similar situation exists with the Tembec company which is about 100 miles north of Ottawa. If such an undertaking would create jobs, why could the Department of National Revenue not say that it would allow it and give the advance ruling? Why could it not do that in the case of Tembec?
If there were corporations which were putting together non-productive, limited partnerships that would not create jobs, the department could refuse to give an advance ruling in such a case.
The Prime Minister came to Sault Ste. Marie and Algoma twice in July to say that he would see that the plant would be completed. When the company laid down its proposal at a meeting in September, there was no indication that the Government was going to disallow it. Lo and behold, two weeks later this advance ruling by the Department of National Revenue was outlawed so that the opportunity to complete this $350 million tube mill is foreclosed.
I realize that the Hon. Member is saying that the advance ruling mainly applies to this kind of circumstance, but it is in these kinds of circumstances where the Government is, in effect, copping out from its responsibility to give advance rulings.

",Liberal,,Maurice Brydon Foster,http://www.parl.gc.ca/parlinfo/Files/Parliamentarian.aspx?Item=04c88469-fd47-40e9-b8ad-fbb8a173dcb9&Language=E&Section=ALL
3494513,ca.proc.d.1984-11-13.1.1.41,1984-11-13,7dcf3dd2-39d7-4162-a494-1c4ca12ab718,ca.m.6145,Mr. Deputy Speaker:,Deputy Speaker and Chair of Committees of the Whole of the House of Commons,SPEECH FROM THE THRONE,RESUMPTION OF DEBATE ON ADDRESS IN REPLY,,"The time for questions and comments on the Hon. Member's speech has now expired.

",Progressive Conservative,,Marcel Danis,http://www.parl.gc.ca/parlinfo/Files/Parliamentarian.aspx?Item=7dcf3dd2-39d7-4162-a494-1c4ca12ab718&Language=E&Section=ALL
3494514,ca.proc.d.1984-11-13.1.1.42,1984-11-13,b7f39a72-55df-48bd-acff-73eeb8fe2318,ca.m.327,Mr. Stan Darling (Parry Sound-Muskoka):,,SPEECH FROM THE THRONE,RESUMPTION OF DEBATE ON ADDRESS IN REPLY,,"Mr. Speaker, it is certainly a privilege for me to say a few words about the Speech from the Throne as well as the statement by the Minister of Finance (Mr. Wilson) last Thursday evening. At this time I would also like to congratulate the mover of the Speech from the Throne, the Hon. Member for Sarnia-Lamb-ton (Mr. James), and the seconder, the Hon. Member for Montreal-Mercier (Mrs. Jacques). I think it is rather unusual that two seatmates moved and seconded the Speech from the Throne. I also believe that they have the same name because, according to my limited French, I believe the names ""Jacques"" and ""James"" are the same.
The Speech from the Throne commencing the Thirty-third Parliament was certainly impressive. Much to the disappointment of the Opposition, it did not go into great detail. However, the Speech from the Throne certainly charted a course. The statements and remarks of the Minister of Finance of last Thursday evening clarified a good deal of what the Canadian people want and are expecting. Canada now has, shall we say, returned to the land of the free.

",Progressive Conservative,,Stan Darling,http://www.parl.gc.ca/parlinfo/Files/Parliamentarian.aspx?Item=b7f39a72-55df-48bd-acff-73eeb8fe2318&Language=E&Section=ALL
3494515,ca.proc.d.1984-11-13.1.1.43,1984-11-13,intervention,,,,SPEECH FROM THE THRONE,RESUMPTION OF DEBATE ON ADDRESS IN REPLY,,"Hear, hear!

",,,Some Hon. Members:,
3494516,ca.proc.d.1984-11-13.1.1.44,1984-11-13,b7f39a72-55df-48bd-acff-73eeb8fe2318,ca.m.327,Mr. Darling:,,SPEECH FROM THE THRONE,RESUMPTION OF DEBATE ON ADDRESS IN REPLY,,"This Government is going to free Canadians from a mushrooming deficit. If any statement or message was given to the people of Canada by this new Government, it was that something had to be done to reduce the deficit, to put Canadians back to work and to give Canada's private industry and its entrepreneurs a chance to see what they can do. Past government mismanagement and mishandling of programs and its entry into the private field proved most unsuccessful.
As we are all aware, we are now faced with 1,400,000, give or take, unemployed. Band-aid approaches give some shortterm assistance but the idea is to get Canadians, young and old, back to work in long-term, challenging and, let us say, permanent jobs.
The Prime Minister (Mr. Mulroney) at this very moment is meeting with the Premiers of the provinces to discuss plans for the future of Canada, to set up goals and various projects for a First Ministers' conference some time early in the new year. We wish them well in this endeavour. Future conferences will be of a different type. First Ministers will sit down and discuss on an friendly basis, and I can emphasize ""friendly"", rather than on a confrontational basis, the way it was in the past.

",Progressive Conservative,,Stan Darling,http://www.parl.gc.ca/parlinfo/Files/Parliamentarian.aspx?Item=b7f39a72-55df-48bd-acff-73eeb8fe2318&Language=E&Section=ALL
3494517,ca.proc.d.1984-11-13.1.1.45,1984-11-13,intervention,,,,SPEECH FROM THE THRONE,RESUMPTION OF DEBATE ON ADDRESS IN REPLY,,"Hear, hear!

",,,Some Hon. Members:,
3494518,ca.proc.d.1984-11-13.1.1.46,1984-11-13,b7f39a72-55df-48bd-acff-73eeb8fe2318,ca.m.327,Mr. Darling:,,SPEECH FROM THE THRONE,RESUMPTION OF DEBATE ON ADDRESS IN REPLY,,"Possibly a year down the road at the conference we will see another Conservative Government representing the Province of Manitoba joining in to discuss the future of Canada.

",Progressive Conservative,,Stan Darling,http://www.parl.gc.ca/parlinfo/Files/Parliamentarian.aspx?Item=b7f39a72-55df-48bd-acff-73eeb8fe2318&Language=E&Section=ALL
3494519,ca.proc.d.1984-11-13.1.1.47,1984-11-13,f1c7ac20-4d9c-4bfe-8df8-aaf28bd8a3ef,ca.m.7013,Mr. Manly:,,SPEECH FROM THE THRONE,RESUMPTION OF DEBATE ON ADDRESS IN REPLY,,"Not likely.

",New Democratic Party,,James Douglas Manly,http://www.parl.gc.ca/parlinfo/Files/Parliamentarian.aspx?Item=f1c7ac20-4d9c-4bfe-8df8-aaf28bd8a3ef&Language=E&Section=ALL
3494520,ca.proc.d.1984-11-13.1.1.48,1984-11-13,b7f39a72-55df-48bd-acff-73eeb8fe2318,ca.m.327,Mr. Darling:,,SPEECH FROM THE THRONE,RESUMPTION OF DEBATE ON ADDRESS IN REPLY,,"I notice that last remark of mine did not register too well in the NDP section of this House.

",Progressive Conservative,,Stan Darling,http://www.parl.gc.ca/parlinfo/Files/Parliamentarian.aspx?Item=b7f39a72-55df-48bd-acff-73eeb8fe2318&Language=E&Section=ALL
3494521,ca.proc.d.1984-11-13.1.1.49,1984-11-13,intervention,,,,SPEECH FROM THE THRONE,RESUMPTION OF DEBATE ON ADDRESS IN REPLY,,"Oh, oh!

",,,Some Hon. Members:,
