basepk,hid,speechdate,pid,opid,speakeroldname,speakerposition,maintopic,subtopic,subsubtopic,speechtext,speakerparty,speakerriding,speakername,speakerurl
3494801,ca.proc.d.1984-11-13.19.2.1.2,1984-11-13,8de7e1bf-358f-42b2-b015-259ec4e31868,ca.m.7203,Mr. Geoff Wilson (Swift Current-Maple Creek):,,PROCEEDINGS ON ADJOURNMENT MOTION,SPEECH FROM THE THRONE,RESUMPTION OF DEBATE ON ADDRESS IN REPLY,"Mr. Speaker, it is my pleasure to congratulate you and the Hon. Mr. Bosly on your appointments. I also congratulate the mover and seconder of this debate as well as the preceding speaker, the Hon. Member for Winnipeg-Birds Hill (Mr. Blaikie), on his re-election and his contribution to this debate.
Mr. Speaker, since this is my maiden speech in the House of Commons I would first like to thank the people of southwestern Saskatchewan for sending me to Ottawa to represent them. I will try to the best of my ability to justify the confidence that they have placed in me.
I am grateful to my colleagues in the House who have been quick and generous with their counsel and advice.
I pay tribute to my predecessors, Frank Hamilton and Jack McIntosh. It was Mr. McIntosh who first aroused my interest in the Party. I thank them for sharing their wisdom and experience with me.
The riding of Swift Current-Maple Creek is located in the southwestern corner of Saskatchewan, bordered on the south by the State of Montana, on the north by the South Saskatchewan River, on the west by the Province of Alberta, and running approximately 150 miles east into Saskatchewan to include such villages and towns as Ernfold, Hodgeville, Mey-ronne and McCord. The population in 1981 was some 53,000 people. The area comprises some 18,700 square miles from Leader in the northwest to Mankota in the southeast, from Consul in the southwest to Morse in the northeast.
Southwestern Saskatchewan is almost totally agricultural and comprises a vast farming and ranching area. It was pioneered largely in the early 1900s by hardy settlers from the northern United States, Ontario and Europe. They were men and women who carved out the oft-times inhospitable Palliser Triangle, a heritage for succeeding generations.
The main centre of population is the City of Swift Current, also known as ""Speedy Creek"". Some attribute this name to our winds because I am told that Swift Current has the second highest mean wind velocity in Canada. The remainder of the population is divided evenly between some 69 towns and villages, the largest of which are Maple Creek and Shaunavon, and the farm community.
While Swift Current owes its beginnings to the railway which arrived in the winter of 1882-83, it owes its continuing prosperity as a centre of supply to the surrounding farmers and ranchers. Agriculture is far and away the predominant economic force. Approximately 80 per cent of those in agriculture
November 13, 1984

are grain farmers; 15 per cent are cattle ranchers and 5 per cent of the operations are mixed. The average farm investment is approximately $600,000.
The second main industry is the oil field servicing sector, maintaining fields lying to the west of Swift Current and running north and south of Gull Lake. The Dominion Agricultural Research Station in Swift Current is famous throughout the West for its research and development of varieties such as Leader Wheat, Wascana and Wakooma Durum and Rambler alfalfa.
The area is a hunter's paradise with literally thousands of hunters converging in the fall to hunt geese, chicken, pheasant, antelope and deer. Liberals are off-limits, having been declared an endangered species.
The riding contains a number of interesting sights such as the Great Sandhills, south of Sceptre the Prairie Wildlife Centre near Webb, the Grasslands National Park, which is an area east of Val Marie for which land is presently being assembled, the Frontier Days Rodeo in Swift Current, and Fort Walsh National Historic Park, which was home of the Royal Northwestern Mounted Police in the 1870s. Finally, there is Cypress Hills Provincial Park which rises out of the prairie south of Maple Creek to a pine covered bench land, which, at 4,560 feet, is the highest point in Saskatchewan. In fact, it is the highest point of land between the Rockies in Alberta and the Laurentians in Quebec. From this vantage point, I am pleased to note, there are no Liberals to be seen for 600 miles in either direction.
According to Statistics Canada, English is the mother tongue of 79 per cent of my constituents, German of 13 per cent and French of 3 per cent. Some 93 per cent of families are headed by two parents, and 78 per cent live in owner-occupied private homes. Swift Current-Maple Creek is a very stable and, if I may say, conservative area. The population turnover is quite low, and we have many three generation farmers and ranchers. The values are traditional. The people believe in God, home and the family. They are church-going people who love Canada.
They have been appalled for years by the state of affairs in this country. They despaired at the economic chaos and felt the disunity. They were saddened at the sight of region tearing at region and Canadian confronting Canadian. They felt sickened at government intervention in the market-place, oppressed at an unreasonable taxation system, and disappointed at the lack of regard for individual enterprise and initiative. They were astonished at incredible man-made disasters such as the national energy policy and the 1981 Budget. They welcome the new spirit of consultation and co-operation.
The spectre of capital gains tax hangs like a sword over the farm community. The farmer struggles for years to pay off his land, which is a non-depreciable asset but which is paid for out of after-tax dollars. The farmer's retirement is in his land. It is truly locked in the ground. Therefore, we have the sad plight of a man who works diligently for a lifetime, only to find that he cannot transfer title to his children for a reasonable sum
The Address-Mr. Wilson (Swift Current-Maple Creek) without facing substantial income tax on the capital gain, which is nothing more than a tax on inflation.
The farm community is heartened to note that some interim relief is in sight. The first $120,000 of taxable capital gains can be rolled into a Registered Retirement Savings Plan, effective January 1, 1984. I say that it is interim relief because we hope that in due course the parliamentary committee will see fit to recommend the elimination of capital gains altogether on agricultural land dispositions. The farmer is first entitled to this special consideration for he is a price taker who is subject to the vagaries of the world market at one end and yet unable to control many of his cost inputs at the other.
In many ways the small businessman is in similar circumstances. His retirement is tied up in inventory or company shares. He also feels threatened by capital gains and by the unnecessary complexity of the tax system. Facing a deluge of forms, questionnaires and surveys, even the smallest business must have extra staff to keep up with the paper work.
Small business will welcome the initiatives in simplifying the tax system and particularly in eliminating the cumulative deduction account. It is my further hope that some means may soon be found to eliminate or at least soften the impact of capital gains on the small business sector. >
b*
Earlier this year Canadians watched with interest the work of the PC tax task force, and they applaud the new Minister of National Revenue (Mr. Beatty) for listening and acting. All Canadians will welcome the introduction of legislation ensuring that no taxpayer need pay taxes in dispute before his case has been finalized.
As a new Member of Parliament who, according to the media, is far removed from the Cabinet and the decision-making process, I am pleased to say that I have had easy personal access to the Ministers and their staff and that the serious problems of my constituency receive a fair hearing. For example, I cite the legitimate concerns of the producers in the Hallonquist and McMahon areas over the possible loss of the Shamrock rail line. It is the same line which was to form part of the basic rail network as a result of the CTC decision of 1980 and thus be guaranteed to the year 2000. These are the same producers who were assured by the previous Minister of Transport that the necessary Order in Council would be passed to enshrine the CTC decision.
I am delighted to report that the new Minister of Transport (Mr. Mazankowski) moved quickly and responsibly on the request for the adjournment of the CTC abandonment hearing to allow fair notice and time to prepare and, most important, time for the Minister to study fully the whole question of rail line abandonment and rehabilitation, with particular reference to finding the most cost efficient transportation alternative.
During the past number of years, western Canadian grain producers have managed to cope with the cost-price squeeze through high sales volumes. The drought and consequent short crop have resulted in a desperate situation for many farmers and ranchers who are faced with ever higher input costs such as fuel, chemical, fertilizer, feed and carrying charges.

November 13, 1984
The Address-Mr. Wilson (Swift Current-Maple Creek)
1 would like to list a number of responses already made by the Minister of Agriculture (Mr. Wise) and the Minister of State for the Canadian Wheat Board (Mr. Mayer). First, there is the final payment of $123 million under the Western Grain Stabilization Plan, coupled with the important commitment to make pay-outs more flexible and time-responsive relative to the seasonal needs of the producer. It is the intention of the Government to attempt to initiate a substantial interim payment for 1984-85 in time to assist in the cost of spring seeding.
Second, in response to the drastic position of a significant percentage of the agricultural community, the Minister has imposed a freeze on Farm Credit Corporation foreclosure activity until January, 1985, pending a thorough review in an attempt to seek innovative ways to deal with the problem.
Third, there will be immediate capital gains relief, which will assist older farmers to retire in dignity and at the same time enable younger farmers to begin with less debt load.
Four, there will be improvements to farm rollover provisions, expanding the definition of child and enlarging the definition of land qualifying for the rollover, all of which will relieve substantial impediments to farm estate planning and intergenerational transfers.
Five, a number of agricultural taxation issues, including the question of part time, Section 31 of the Income Tax Act relating to farmers, the question of agri-bonds and the taxation of capital gains on farm land, will be referred to a parliamentary committee for expeditious study and report.
Six, there will be substantial fuel cost relief, as promised, in the form of a three-cent a litre sales tax rebate on farm fuels and an exemption from the 1.8 cent per litre increase in the petroleum compensation charge, giving a total benefit of almost 22 cents a gallon.
The foregoing are but some of the initiatives already put forward in the few short weeks of this Government. They represent a caring and practical response to some very real problems.
It is the hope of many of my constituents that an increase will be made in the domestic wheat price. At present, the return to the bread wheat producer is the equivalent of something less than two slices out of a standard loaf of bread. A 50 per cent increase in the domestic wheat price would cost the Canadian consumer approximately 5 cents per loaf. Surely, Canadians would find this a small price to pay to assist in the survival of Canadian agriculture.
Many constituents in Swift-Current-Maple Creek remain most resentful of metric and the arbitrary and high-handed way it has been imposed. Metric measurement has caused considerable hardship, unnecessary expense and occasional catastrophe to the agricultural community, particularly in the application of chemicals and fertilizer. They welcome the undertaking to allow Imperial measurement on these containers.
The oil and gas sector in my constituency and Saskatchewan in general has, through sensible provincial royalty provisions, experienced a real boom. It is hoped that a similar common sense federal approach will foster unprecedented oil and gas development. We applaud the recent natural gas export licence amendments enabling Canadian companies to export gas to the United States, thus benefiting the industry, producing provinces and Canada as a whole. This will earn more export revenue, which will in turn strengthen our dollar and lessen pressure on interest rates.
The problem of unemployment, particularly among the young, is grave. This is the bitter fruit of years of economic stagnation and of government mismanagement. It will not be easily overcome. A string of massive deficits and consequent high interest rates, coupled with retrograde policies which discourage risk taking, have caused unprecedented economic malaise. Short-term solutions will not work. We need a fundamental change of direction in this country, a change which is well documented in the Throne Speech and the economic statement, change which through consultation and consensus will restore fiscal responsibility, remove obstacles to growth and encourage new investment.
1 will touch briefly on some of the pressing concerns of my constituents. Many of them have quite properly raised concerns over problems in the collection of child maintenance payments. I can think of no legitimate reason for a father to dodge payments for child support, thus throwing the burden on the rest of society. This problem of long standing is under examination and, in a new spirit of co-operation and dialogue with the provinces, I am optimistic that real progress will be made.
The people of Swift Current-Maple Creek express consternation over abuses in the parole system. Many also favour a return to capital punishment. I personally share these concerns and intend to work for both a thorough overhaul of the parole system and a return to the death penalty in situations of first degree murder.
I have received many queries regarding the situation in Ethiopia, and while Canada has already made a generous contribution, it is our intention, as expressed through the Right Hon. Secretary of State for External Affairs (Mr. Clark), to mobilize a national campaign of relief. Information will be forthcoming from all Members of Parliament to groups in their constituencies'as to how best assistance can be marshalled and funnelled into these grief-stricken areas.
Further, in the international arena, Mr. Speaker, peace must be our most cherished goal. No group, and certainly no political Party, has a monopoly on the desire for world peace and nuclear disarmament. We can collectively leave for our children no greater legacy than a world free of the nuclear threat. I congratulate the Prime Minister (Mr. Mulroney) and the Secretary of State for External Affairs for their initiative in the appointment of Mr. Roche as the ambassador for disarmament.
At the same time, Canada, if it is to be taken seriously in the world, must act on its own as a sovereign nation and live
November 13, 1984

up to its obligations. I am pleased to note that Canada will again fully participate in NATO, and thus earn its place at the table of responsible nations.
As the Member for Swift Current-Maple Creek riding, which shares 150 miles of border with the State of Montana, part of the longest undefended border in the world, I recognize the United States of America as our neighbour, our largest trading partner and our best friend. I have been ashamed of the attitude of the past Government toward the United States for we, Canadians and Americans, share the fruits of freedom. We must likewise share the responsibilities. My constituents and I congratulate the Prime Minister in his efforts to renew our bonds of friendship with the United States. We applaud this very sensible and historically desirable initiative.
The thrust of the Throne Speech is reassuring to Canadians. At a time when this nation is reeling under the weight of record unemployment and staggering debt, most people understand what has to be done. They understand we cannot long continue to mortgage tomorrow to pay for today. They know tough decisions have to be made. They know we cannot forever print money to throw at the symptoms of the disease. We must deal directly with the cause. We must recognize our excess. We must renew confidence in Canada. We must rebuild our reputation. The way will be long and arduous, but if we are to survive as a strong and free nation, we have absolutely no choice.
I ask Canadians to take heart because this Government, under the leadership of the Right Hon. Prime Minister, stands united, united in its determination to rebuild over the ashes of years of Liberal neglect, united in its determination to get this country moving again, and united in its determination to secure a fair shake for all Canadians.
In conclusion, Mr. Speaker, I am proud to be part of a Government that will breathe new life into this country, a Government that will listen to and work with the people, a Government that will seek a new spirit of co-operation and consensus for the Canada we love and cherish.
It has been an honour for me to participate in this Throne Speech debate.

",Progressive Conservative,,Geoff Wilson,http://www.parl.gc.ca/parlinfo/Files/Parliamentarian.aspx?Item=8de7e1bf-358f-42b2-b015-259ec4e31868&Language=E&Section=ALL
3494802,ca.proc.d.1984-11-13.19.2.1.3,1984-11-13,7dcf3dd2-39d7-4162-a494-1c4ca12ab718,ca.m.6145,Mr. Deputy Speaker:,Deputy Speaker and Chair of Committees of the Whole of the House of Commons,PROCEEDINGS ON ADJOURNMENT MOTION,SPEECH FROM THE THRONE,RESUMPTION OF DEBATE ON ADDRESS IN REPLY,"Are there any questions or comments? There being none, we will continue with debate. The Hon. Member for Sudbury (Mr. Frith).

",Progressive Conservative,,Marcel Danis,http://www.parl.gc.ca/parlinfo/Files/Parliamentarian.aspx?Item=7dcf3dd2-39d7-4162-a494-1c4ca12ab718&Language=E&Section=ALL
