basepk,hid,speechdate,pid,opid,speakeroldname,speakerposition,maintopic,subtopic,subsubtopic,speechtext,speakerparty,speakerriding,speakername,speakerurl
3494694,ca.proc.d.1984-11-13.12.32.3,1984-11-13,98078e8b-69ab-40bf-93fc-21dc96a61e88,ca.m.1495,Mr. Keeper:,,ORAL QUESTION PERIOD,BACKGROUND DOCUMENTATION,,"Yes, a supplementary question, Mr. Speaker. In preparation for this meeting in Winnipeg, would the Minister share with Manitobans the documentation and background papers upon which the decision was made to cut out the Manufacturing Technology Institute in Manitoba?

",New Democratic Party,,Cyril Keeper,http://www.parl.gc.ca/parlinfo/Files/Parliamentarian.aspx?Item=98078e8b-69ab-40bf-93fc-21dc96a61e88&Language=E&Section=ALL
3494695,ca.proc.d.1984-11-13.12.32.4,1984-11-13,1babc9d3-8d8a-489e-99f2-d360a5ab621b,ca.m.8020,Hon. Thomas Siddon (Minister of State for Science and Technology):,Minister of State for Science and Technology,ORAL QUESTION PERIOD,BACKGROUND DOCUMENTATION,,"Mr. Speaker, there were no analyses on which to predicate the spin-off that was alleged to arise from this Manufacturing Technology Centre. The real issue here is one of political philosophy. It is a question of whether our Liberal and Socialist friends across the way believe that we can continue to throw government dollars at the creation of jobs, or stimulate the private sector to do so. In the case of the Centre for Manufacturing Technology, that facility will be turned to the use of the economy of the Province of Manitoba and to the creation of thousands of new jobs in that province.

",Progressive Conservative,,Thomas Edward Siddon,http://www.parl.gc.ca/parlinfo/Files/Parliamentarian.aspx?Item=1babc9d3-8d8a-489e-99f2-d360a5ab621b&Language=E&Section=ALL
3494696,ca.proc.d.1984-11-13.12.33,1984-11-13,,,,subtopic,ORAL QUESTION PERIOD,PARLIAMENT HILL,,,,,,
3494697,ca.proc.d.1984-11-13.12.33.1.1,1984-11-13,ebe8c134-a268-4c7b-961f-586efaa243a1,ca.m.6261,Mr. Don Blenkarn (Mississauga South):,,ORAL QUESTION PERIOD,PARLIAMENT HILL,REQUEST THAT PEACE CAMP BE REMOVED,"Mr. Speaker, my question is for the Minister of Public Works. The Peace Camp has been sitting on Parliament Hill for nearly two years. Is the Minister of Public Works going to remove the Peace Camp, or is he going to make rules and regulations to allow other people who may wish to protest to Parliament to set up permanent booths and camps and so on, on parliamentary facilities?

",Progressive Conservative,,Donald Alex Blenkarn,http://www.parl.gc.ca/parlinfo/Files/Parliamentarian.aspx?Item=ebe8c134-a268-4c7b-961f-586efaa243a1&Language=E&Section=ALL
3494698,ca.proc.d.1984-11-13.12.33.1.2,1984-11-13,ebd92091-9ee2-4ef1-920e-532f3ed627aa,ca.m.7209,Hon. Roch La Salle (Minister of Public Works):,Minister of Public Works,ORAL QUESTION PERIOD,PARLIAMENT HILL,REQUEST THAT PEACE CAMP BE REMOVED,"Mr. Speaker, I have the impression that my colleague is asking me to do in a few weeks something which the previous Government failed to do in 18 months. Still, I might say that since temperatures are usually somewhat colder in winter time, I dare hope that we will not have to pass legislation on that issue, but that those people will look upon the coming winter months as an opportunity to find shelter in warmer surroundings and that there will be no need to urge them to leave Parliament grounds.

",Progressive Conservative,,Roch La Salle,http://www.parl.gc.ca/parlinfo/Files/Parliamentarian.aspx?Item=ebd92091-9ee2-4ef1-920e-532f3ed627aa&Language=E&Section=ALL
3494699,ca.proc.d.1984-11-13.12.34,1984-11-13,,,,subtopic,ORAL QUESTION PERIOD,PETITIONS,,,,,,
3494700,ca.proc.d.1984-11-13.12.34.1.1,1984-11-13,79f88cbc-2e18-4315-a896-76b94a25252f,ca.m.4236,Mr. Speaker:,Speaker pro tempore,ORAL QUESTION PERIOD,PETITIONS,TABLING OF REPORTS BY CLERK OF PETITIONS,"I have the honour to inform the House that the petitions, with the exception of one, presented by Hon. Members on Friday, November 9, 1984, meet the requirements of the Standing Orders as to form.
Point of Order-Mr. Deans ECONOMIC STATEMENT OF MINISTER OF FINANCE

",Progressive Conservative,,Martial Asselin,http://www.parl.gc.ca/parlinfo/Files/Parliamentarian.aspx?Item=79f88cbc-2e18-4315-a896-76b94a25252f&Language=E&Section=ALL
3494701,ca.proc.d.1984-11-13.12.34.1.2,1984-11-13,79f88cbc-2e18-4315-a896-76b94a25252f,ca.m.4236,Mr. Speaker:,Speaker pro tempore,ORAL QUESTION PERIOD,PETITIONS,TABLING OF REPORTS BY CLERK OF PETITIONS,"1 regret to inform the House that the petition presented by the Elon. Member for Hamilton East (Ms. Copps) does not meet the requirements of the Standing Orders as to form.

",Progressive Conservative,,Martial Asselin,http://www.parl.gc.ca/parlinfo/Files/Parliamentarian.aspx?Item=79f88cbc-2e18-4315-a896-76b94a25252f&Language=E&Section=ALL
3494702,ca.proc.d.1984-11-13.13,1984-11-13,,,,topic,POINT OF ORDER,,,,,,,
3494703,ca.proc.d.1984-11-13.13.1,1984-11-13,,,,subtopic,POINT OF ORDER,ALLEGED CITATION OF REPORT BY MR. WILSON,,,,,,
3494704,ca.proc.d.1984-11-13.13.1.1,1984-11-13,a4b9c466-c43b-4a3e-b69f-c1bc1878fe3c,ca.m.154,Mr. Ian Deans (Hamilton Mountain):,N.D.P. House Leader,POINT OF ORDER,ALLEGED CITATION OF REPORT BY MR. WILSON,,"Mr. Speaker, I rise on a point of order which relates directly to an exchange that took place between the Hon. Member for Oshawa (Mr. Broad-bent), the Leader of the New Democratic Party, and the Minister of Finance (Mr. Wilson). You will recall that during the Question Period the Member for Oshawa requested the Minister of Finance to place on the record before the public of Canada and the House of Commons the information pertaining to the number of jobs that would be affected by the recently tabled economic statement of the Minister.
The Minister referred to two matters. In his reply he acknowledged the existence of a report which showed the number of jobs which would be affected by the Government's economic measures that were announced last Thursday. The second point I want to make is that the Minister, in acknowledging the existence of the report, made precise reference to the content of the report indicating the effect of the economic statement on the number of jobs gained or lost in Canada as analyzed by the Finance Ministry and reported to the Minister. The Minister used that particular citation in an effort to influence the debate which is presently taking place in the House of Commons and also to influence the public of Canada in believing that the reference to which he referred was of little consequence.
I am sure it is not necessary but I draw your attention to Beauchesne's Fifth Edition, page 115. Under the heading ""Documents Cited"", Citation 327(1) reads:
A Minister of the Crown is not at liberty to read or quote from a despatch or other state paper not before the House, unless he be prepared to lay it upon the Table.
It goes on at some length but that is the relevant sentence. Citation 327(4) reads as follows:
Only the document cited need be tabled by a Minister. A complete file need not be tabled because one document in it has been cited.
Paragraph 5 is the relevant part:
To be cited, a document must be quoted or specifically used to influence debate.
Last Thursday the Minister rose in the House of Commons and delivered a speech. That speech resulted in a response from both Opposition Parties and was the catalyst for the exchange which took place today. It was as a result of the speech of the Minister that questions were asked today. Therefore the questions today are very much a part of the ongoing

November 13, 1984
Point of Order-Mr. Deans
debate in public terms over the relevance and import of the economic statement of the Minister of Finance.
We know that it has been the practice in the House of Commons for Ministers to be requested to table documents that they have used and cited as relevant and pertinent information for the purpose of influencing decisions or, for that matter, the views of Members of the House and the public. I can recall at least two occasions during the last Parliament when Ministers were asked to table letters which they had indicated were in existence and from which they had drawn certain paragraphs in order to shore up arguments they were attempting to make during the Question Period.
Therefore I would ask you, Mr. Speaker, to review what the Minister has done and consider whether it is appropriate for him to use a document provided to him by Ministry officials, which speaks directly to a question being asked of him by Members of the Opposition, in such a way as to influence the debate, without tabling the appropriate document.
In my judgment and I believe that of many Members, I suggest it would be appropriate and correct that the Minister be required to place upon the table the reports that were given to him by the Ministry officials, such reports as were cited by him during his exchange with the Leader of the New Democratic Party, which would answer conclusively the question we have been asking during the last two to three days about the effect of the economic statement on the number of jobs that will be lost in Canada.
The Minister says that he has documents which show that the effect will be minimal, which are almost his exact terms. He said that those are documents provided to him by Ministry officials. He has refused to make those documents and that information available to Members of the House of Commons and therefore to the public of Canada. He is attempting to influence the public view of the appropriateness of the actions being put forward by the Government without being prepared to back it up statistically or with the evidence that is available to him. I simply ask that he be required to table the documents.

",New Democratic Party,,Ian Deans,http://www.parl.gc.ca/parlinfo/Files/Parliamentarian.aspx?Item=a4b9c466-c43b-4a3e-b69f-c1bc1878fe3c&Language=E&Section=ALL
3494705,ca.proc.d.1984-11-13.13.1.2,1984-11-13,4e3a9e68-a6fb-4e24-9458-cfe2e836c8bc,ca.m.4873,Hon. Herb Gray (Windsor West):,Official Opposition House Leader; Liberal Party House Leader,POINT OF ORDER,ALLEGED CITATION OF REPORT BY MR. WILSON,,"Mr. Speaker, during the course of Question Period the Minister of Finance (Mr. Wilson) did not simply refer to the existence of a document in general terms; he appeared to be citing from it and using words which would appear to any reasonable person to be drawn directly from the document in question. The Minister or the Government House Leader (Mr. Hnatyshyn) may argue that technically Question Period is not a debate in the House, but I submit that this Question Period took place in the middle of one of the most important debates that can take place in any parliamentary session. It is the debate on the Address in Reply to the Speech from the Throne.
In addition, I think you are entitled to take judicial notice that there is a debate in the country arising out of the statement given by the Minister of Finance last week. Therefore I submit that what the Minister of Finance did during this Question Period falls squarely within the ambit of the precedents in this regard, that he should be obliged by you to table the document which he cited so specifically before the House so the House of Commons and, more important, the people of Canada will know the truth about exactly how much damage will be done to them as a result of the measures announced in the statement given by the Minister of Finance last week.

",Liberal,,Herbert Eser (Herb) Gray,http://www.parl.gc.ca/parlinfo/Files/Parliamentarian.aspx?Item=4e3a9e68-a6fb-4e24-9458-cfe2e836c8bc&Language=E&Section=ALL
3494706,ca.proc.d.1984-11-13.13.1.3,1984-11-13,361aacdc-d558-4338-bab0-b4912b70dac5,ca.m.6663,Hon. Ray Hnatyshyn (Minister of State (Government House Leader)):,Minister of State (Government House Leader); Leader of the Government in the House of Commons; Progressive Conservative Party House Leader,POINT OF ORDER,ALLEGED CITATION OF REPORT BY MR. WILSON,,"Mr. Speaker, may 1 say at the outset that this is the first procedural argument that has been brought forward by the Opposition. Let me say that I know all of their tricks. I spent much time in that position trying to bring up points of order which were not legitimate and I congratulate the Hon. Member for Hamilton Mountain (Mr. Deans) on his attempt, which is clearly defective in terms of being a point of order from a number of points of view.
First, the allegation was made that a specific despatch or state document was quoted from. Indeed, Your Honour will recall that in the course of the debates and indeed in Question Period there have been suggestions or allegations made by the Opposition that econometric models have been used. When the response of the Minister of Finance has been that any advice he received indicated that these models were in fact not germane or relevant to the debate, we now have the Opposition House Leaders coming forward to say that indeed there are documents which were quoted from and specifically cited by the Minister. That is the opposite to the truth.
The Minister, if you recall the debate, Mr. Speaker, responded to a question by the Leader of the New Democratic Party who brought forward not a state document or a despatch but an article from The Ottawa Citizen as some sort of authority for his question. The Minister said he did not accept the proposition put forward in the article. The point of order fails on all counts, Mr. Speaker.
I suggest that Beauchesne is quite specific. First, you have to have the Minister quoting or citing from a despatch or state paper. There has never been any reference by the Minister with respect to any document in a direct or quotable way. The Minister said that he had received advice and used political judgment on behalf of the Government with respect to the whole matter. His responses have been consistent. He said on the basis of advice received by him, as Minister, without quoting or citing in any respect, that any information he has received from any document with respect to projections concerning job gains or job losses has not been relevant to his decision.

",Progressive Conservative,,Ramon John Hnatyshyn,http://www.parl.gc.ca/parlinfo/Files/Parliamentarian.aspx?Item=361aacdc-d558-4338-bab0-b4912b70dac5&Language=E&Section=ALL
3494707,ca.proc.d.1984-11-13.13.1.4,1984-11-13,a4b9c466-c43b-4a3e-b69f-c1bc1878fe3c,ca.m.154,Mr. Deans:,N.D.P. House Leader,POINT OF ORDER,ALLEGED CITATION OF REPORT BY MR. WILSON,,"He specifically mentioned 1985 and 1986.

",New Democratic Party,,Ian Deans,http://www.parl.gc.ca/parlinfo/Files/Parliamentarian.aspx?Item=a4b9c466-c43b-4a3e-b69f-c1bc1878fe3c&Language=E&Section=ALL
3494708,ca.proc.d.1984-11-13.13.1.5,1984-11-13,361aacdc-d558-4338-bab0-b4912b70dac5,ca.m.6663,Mr. Hnatyshyn:,Minister of State (Government House Leader); Leader of the Government in the House of Commons; Progressive Conservative Party House Leader,POINT OF ORDER,ALLEGED CITATION OF REPORT BY MR. WILSON,,"He made reference to information he has received, advice that he has received, in a general way, but he has not quoted from these documents.

",Progressive Conservative,,Ramon John Hnatyshyn,http://www.parl.gc.ca/parlinfo/Files/Parliamentarian.aspx?Item=361aacdc-d558-4338-bab0-b4912b70dac5&Language=E&Section=ALL
3494709,ca.proc.d.1984-11-13.13.1.6,1984-11-13,a4b9c466-c43b-4a3e-b69f-c1bc1878fe3c,ca.m.154,Mr. Deans:,N.D.P. House Leader,POINT OF ORDER,ALLEGED CITATION OF REPORT BY MR. WILSON,,"He referred specifically.
November 13, 1984

",New Democratic Party,,Ian Deans,http://www.parl.gc.ca/parlinfo/Files/Parliamentarian.aspx?Item=a4b9c466-c43b-4a3e-b69f-c1bc1878fe3c&Language=E&Section=ALL
3494710,ca.proc.d.1984-11-13.13.1.7,1984-11-13,361aacdc-d558-4338-bab0-b4912b70dac5,ca.m.6663,Mr. Hnatyshyn:,Minister of State (Government House Leader); Leader of the Government in the House of Commons; Progressive Conservative Party House Leader,POINT OF ORDER,ALLEGED CITATION OF REPORT BY MR. WILSON,,"He has only made specific reference, Mr. Speaker, to the content of The Ottawa Citizen which was raised by the Leader of the New Democratic Party.
I have one word in my final submission to you, Your Honour. In the case of precedents where there have been documents quoted from by way of letters or other state papers and there has been by way of agreement the tabling by Ministers of certain documents, that has occurred where specific quotations have been used in support of arguments made by Ministers.

",Progressive Conservative,,Ramon John Hnatyshyn,http://www.parl.gc.ca/parlinfo/Files/Parliamentarian.aspx?Item=361aacdc-d558-4338-bab0-b4912b70dac5&Language=E&Section=ALL
3494711,ca.proc.d.1984-11-13.13.1.8,1984-11-13,a4b9c466-c43b-4a3e-b69f-c1bc1878fe3c,ca.m.154,Mr. Deans:,N.D.P. House Leader,POINT OF ORDER,ALLEGED CITATION OF REPORT BY MR. WILSON,,"That is what he did.

",New Democratic Party,,Ian Deans,http://www.parl.gc.ca/parlinfo/Files/Parliamentarian.aspx?Item=a4b9c466-c43b-4a3e-b69f-c1bc1878fe3c&Language=E&Section=ALL
3494712,ca.proc.d.1984-11-13.13.1.9,1984-11-13,361aacdc-d558-4338-bab0-b4912b70dac5,ca.m.6663,Mr. Hnatyshyn:,Minister of State (Government House Leader); Leader of the Government in the House of Commons; Progressive Conservative Party House Leader,POINT OF ORDER,ALLEGED CITATION OF REPORT BY MR. WILSON,,"In this particular instance that was not the case, I suggest, Mr. Speaker. I think on the basis of the submission made, the Opposition is attempting only to get information which may or may not be in existence and which it is unable to obtain in other ways through the Question Period.

",Progressive Conservative,,Ramon John Hnatyshyn,http://www.parl.gc.ca/parlinfo/Files/Parliamentarian.aspx?Item=361aacdc-d558-4338-bab0-b4912b70dac5&Language=E&Section=ALL
3494713,ca.proc.d.1984-11-13.13.1.10,1984-11-13,a4b9c466-c43b-4a3e-b69f-c1bc1878fe3c,ca.m.154,Mr. Deans:,N.D.P. House Leader,POINT OF ORDER,ALLEGED CITATION OF REPORT BY MR. WILSON,,"If I may, I have one final point, Mr. Speaker.

",New Democratic Party,,Ian Deans,http://www.parl.gc.ca/parlinfo/Files/Parliamentarian.aspx?Item=a4b9c466-c43b-4a3e-b69f-c1bc1878fe3c&Language=E&Section=ALL
3494714,ca.proc.d.1984-11-13.13.1.11,1984-11-13,79f88cbc-2e18-4315-a896-76b94a25252f,ca.m.4236,Mr. Speaker:,Speaker pro tempore,POINT OF ORDER,ALLEGED CITATION OF REPORT BY MR. WILSON,,"The Hon. Member for Hamilton Mountain.

",Progressive Conservative,,Martial Asselin,http://www.parl.gc.ca/parlinfo/Files/Parliamentarian.aspx?Item=79f88cbc-2e18-4315-a896-76b94a25252f&Language=E&Section=ALL
3494715,ca.proc.d.1984-11-13.13.1.12,1984-11-13,a4b9c466-c43b-4a3e-b69f-c1bc1878fe3c,ca.m.154,Mr. Deans:,N.D.P. House Leader,POINT OF ORDER,ALLEGED CITATION OF REPORT BY MR. WILSON,,"Mr. Speaker, I raise only one final point. The Government House Leader was clearly not listening. The Minister made specific reference to a memorandum he had received from his Ministry officials. He went further and quoted what the memorandum contained by way of a projection for the years 1985 and 1986 specifically.
I would ask you, Sir, if you are in a position to render a judgment-and, of course, you ought to-and if it is to be based on the suggestion of the Hon. Government House Leader that somehow the Minister made no such reference, that you await receiving the record of Hansard to determine whether or not, at least on the basis of that part of the argument, there is any validity to the suggestion made by the House Leader for the Government that we do not have the basis for a point of order.

",New Democratic Party,,Ian Deans,http://www.parl.gc.ca/parlinfo/Files/Parliamentarian.aspx?Item=a4b9c466-c43b-4a3e-b69f-c1bc1878fe3c&Language=E&Section=ALL
3494716,ca.proc.d.1984-11-13.13.1.13,1984-11-13,79f88cbc-2e18-4315-a896-76b94a25252f,ca.m.4236,Mr. Speaker:,Speaker pro tempore,POINT OF ORDER,ALLEGED CITATION OF REPORT BY MR. WILSON,,"I must advise Hon. Members that I intend not to make a judgment today. I think it would be fair to the House that my first ruling should be reserved, even if I did know the answer.
I want to say to the Hon. Member for Hamilton Mountain that I listened extremely carefully, as he would expect, to the Minister of Finance (Mr. Wilson) the moment the Minister of Finance began to refer to some conclusions, as I remember. However, I want to check the blues. I say this to the Hon. Member because there are two points here. Beauchesne is absolutely clear in Citation 327(4) that the document must be quoted. The consequential problem is that this House has always dealt separately with the use of documents and points of order relating to documents with regard to Question Period. It has always done that according to my reading of the Jerome precedents and before that. Before I could evaluate that, I would have to determine, I think, whether a document had been quoted or whether in fact, as I thought 1 heard-which is
Petitions
why I want to check the blues before I say anything finally- the Minister referred to the general conclusions of a document as opposed to specifically quoting a document.
If that is true, then I suggest a point of order on the second part of the concern does not follow because a document has not for the purposes of the House been specifically quoted.

",Progressive Conservative,,Martial Asselin,http://www.parl.gc.ca/parlinfo/Files/Parliamentarian.aspx?Item=79f88cbc-2e18-4315-a896-76b94a25252f&Language=E&Section=ALL
3494717,ca.proc.d.1984-11-13.13.1.14,1984-11-13,a4b9c466-c43b-4a3e-b69f-c1bc1878fe3c,ca.m.154,Mr. Deans:,N.D.P. House Leader,POINT OF ORDER,ALLEGED CITATION OF REPORT BY MR. WILSON,,"It does not have to be.

",New Democratic Party,,Ian Deans,http://www.parl.gc.ca/parlinfo/Files/Parliamentarian.aspx?Item=a4b9c466-c43b-4a3e-b69f-c1bc1878fe3c&Language=E&Section=ALL
3494718,ca.proc.d.1984-11-13.13.1.15,1984-11-13,79f88cbc-2e18-4315-a896-76b94a25252f,ca.m.4236,Mr. Speaker:,Speaker pro tempore,POINT OF ORDER,ALLEGED CITATION OF REPORT BY MR. WILSON,,"With respect to the Hon. Member and with respect to all our newness to this question, I intend to reserve on the matter and to check the blues. I shall be back to the House in this regard.

",Progressive Conservative,,Martial Asselin,http://www.parl.gc.ca/parlinfo/Files/Parliamentarian.aspx?Item=79f88cbc-2e18-4315-a896-76b94a25252f&Language=E&Section=ALL
3494719,ca.proc.d.1984-11-13.13.1.16,1984-11-13,4e3a9e68-a6fb-4e24-9458-cfe2e836c8bc,ca.m.4873,Mr. Gray (Windsor West):,Official Opposition House Leader; Liberal Party House Leader,POINT OF ORDER,ALLEGED CITATION OF REPORT BY MR. WILSON,,"Mr. Speaker, could I ask you to consider one further aspect in reviewing the blues and also in reviewing the precedents. I note in looking at Citation 327 on pages 115 and 116 of Beauchesne that there seems to be a distinction made in the precedents between citing and quoting. I refer, for example, to paragraph 3 on page 116 of Citation 327 which reads:
A public document referred to but not cited or quoted by a Minister need not be tabled.
I respectfully ask you to consider, Sir, whether the Minister of Finance might still be obliged to table the document even though technically he may not have quoted it, but instead if he in fact did something which falls within the ambit of the precedent; that is to say, if he in fact cited a document.

",Liberal,,Herbert Eser (Herb) Gray,http://www.parl.gc.ca/parlinfo/Files/Parliamentarian.aspx?Item=4e3a9e68-a6fb-4e24-9458-cfe2e836c8bc&Language=E&Section=ALL
3494720,ca.proc.d.1984-11-13.13.1.17,1984-11-13,79f88cbc-2e18-4315-a896-76b94a25252f,ca.m.4236,Mr. Speaker:,Speaker pro tempore,POINT OF ORDER,ALLEGED CITATION OF REPORT BY MR. WILSON,,"I take the advice of the Hon. Member and I will consider all the arguments.

",Progressive Conservative,,Martial Asselin,http://www.parl.gc.ca/parlinfo/Files/Parliamentarian.aspx?Item=79f88cbc-2e18-4315-a896-76b94a25252f&Language=E&Section=ALL
3494721,ca.proc.d.1984-11-13.14,1984-11-13,,,,topic,ROUTINE PROCEEDINGS,,,,,,,
3494722,ca.proc.d.1984-11-13.14.1,1984-11-13,,,,subtopic,ROUTINE PROCEEDINGS,PETITIONS,,,,,,
3494723,ca.proc.d.1984-11-13.14.1.1.1,1984-11-13,a247d1d3-3b05-46ac-b9f3-6622ab25d695,ca.m.3905,Right Hon. Joe Clark (Yellowhead):,Secretary of State for External Affairs,ROUTINE PROCEEDINGS,PETITIONS,PEACE AND SECURITY POLICIES,"Mr. Speaker, pursuant to Standing Order 71, I rise to bring to the attention of Parliament a petition signed by many of my constituents and, in total, by some 450,000 Canadians, calling for certain changes in current Canadian international peace and security policies, particularly concerning nuclear arms. I understand that representatives of the other Parties will be joining me in putting this petition to the House.

",Progressive Conservative,,Charles Joseph Clark,http://www.parl.gc.ca/parlinfo/Files/Parliamentarian.aspx?Item=a247d1d3-3b05-46ac-b9f3-6622ab25d695&Language=E&Section=ALL
