basepk,hid,speechdate,pid,opid,speakeroldname,speakerposition,maintopic,subtopic,subsubtopic,speechtext,speakerparty,speakerriding,speakername,speakerurl
3499224,ca.proc.d.1984-11-29.17.4.2,1984-11-29,f6e5da54-c9c9-4020-9356-e92606d6b6c4,ca.m.4332,Mr. George Baker (Gander-Twillingate):,,GOVERNMENT ORDERS,"BORROWING AUTHORITY ACT, 1984-85 (NO. 2) MEASURE TO ENACT",,"Mr. Speaker, I am pleased to say a few words about the amendment which was proposed by the New Democratic Party and about the borrowing authority Bill. 1 would like to refer to a policy statement which was made by the Government regarding Canadian fishermen, in which it proclaimed:
-Canadian fishermen and companies must be encouraged and assisted to modernize their boats ... A Progressive Conservative Government will promote the orderly development of a middle-distance fleet and the present 65-foot upper limit on longliners will be removed.
At various times, prior to the Government coming into power, the Progressive Conservative Party stated its intention to deal fairly and, certainly as it has stated, in a better way, with fishermen than did the previous government.
In looking at the policies which were outlined by the Government, one wonders when they will be instituted. Certainly, they will cost a lot of money. There have been various actions announced by the Minister of Fisheries and Oceans (Mr. Fraser), as well as the various actions which were contained in the Economic Statement of the Minister of Finance (Mr. Wilson).
For example, fishermen will now be charged for the maps they obtain from the federal government which show the coastline. There was a statement by the Minister of the Environment (Mrs. Blais-Grenier) which indicated that persons would be required to pay for their calls to the weather office. Then the Minister of the Environment clarified that by saying that fishermen would be excluded. In other words, there would be certain occupational groups-because they need weather forecasting information, sometimes on an urgent basis due to ever-changing weather patterns-who would not be charged for the telephone call. It is another policy to the detriment of the fishermen, because they will hesitate before contacting the weather office in their area.
The Minister of Fisheries and Oceans also announced that berthage fees would be doubled. Not only that, but as I understand it after checking with the Department of Fisheries, in areas where the berthage fee was not previously charged it will now be charged on an equal basis right across Canada.
The Minister of Employment and Immigration (Miss MacDonald) announced that there would be no special program for fishermen who had a bad fishery this year. Those fishermen went out day after day looking for fish but they could not find the fish. Eventually, when the fishermen realized that the Government was not going to have a special program, such as the one that the previous government had last fall, they kept
going out day after day until they had obtained enough fish to get low unemployment insurance stamps. A great many of them will live throughout the winter receiving welfare along with low unemployment insurance.
The Minister of Fisheries and Oceans then announced that the vessel insurance plan would be discontinued. Sometimes cuts are justified in government Departments. We certainly need more policies from the Department of Fisheries, which are to the advantage of Fishermen. However, certain cuts are announced and decided by someone who looks down from on high and who thinks that an insurance shceme which is run by the government should really be run by private enterprise. Many arguments cannot be put against that philosophy. However, if we examined why the policy was implemented in the mid-fifties, we would discover that it was brought in for one reason. That reason is that there are certain types of fishermen in Canada who do not qualify for private insurance schemes. I suppose that anyone could qualify if they were willing to pay the money. It depends on how high the rate is. But a fisherman with a small boat which is tied to a wharf on the northern peninsula in Newfoundland will not qualify through a private insurance company.
The Minister of Fisheries and Oceans and the Minister of Finance have to realize that they should have consulted with the provincial governments, provincial loan boards, processors, the fishermen's union of Newfoundland, fishermen and the insurance companies before they decided to cancel this scheme. The reason is quite simple. The reason is that fishermen who have insurance policies through the federally-run vessel insurance plan, must have those insurance policies before they can obtain loans through provincial loan boards. That insurance must be in place. The money must come out of the fisherman's pocket. It is not a part of the loan which is granted by the local loan board.
The effect of this measure, which was ill-conceived and implemented without consultation with the people involved in the fishery or the insurance companies, will be that over the next couple of weeks each provincial loan board will have to decide what it will do when the insurance is cancelled, because a condition of the loan was that the fishermen involved must have that insurance policy.
The Minister of Finance and the Minister of Fisheries and Oceans would be well-advised to have that consultation now and to adjust the program to meet the needs of the fishermen. There are a great many problems in the fisheries. If the solution to those problems is to get rid of the fishermen, then this is a great way to do it.
There has been much discussion in the House since the debate began on borrowing authority concerning social programs and the actions of the Minister of Employment and Immigration as they relate to the Unemployment Insurance Commission. There has been much discussion regarding the Canadian Federation of Independent Business and its claim that it has identified 170,000 jobs which people in Canada could fill. One has to look at the people who draw unemploy-
November 29, 1984

ment insurance and understand their problems before initiating a policy which will drastically affect them, Mr. Speaker.
Of all the jobs available to people drawing unemployment insurance, there is only one sure thing available right now, the 700 investigators' jobs announced by the Minister of Employment and Immigration to try to take people off unemployment insurance. These being the only available jobs that I know of, I suggest that everyone on unemployment insurance write to the Minister and apply for one of those jobs. Surely the Minister would look favourably upon some of these applications because someone doing that kind of investigation should have experienced being on uenmployment insurance.
There are various reasons for the attitude on the part of the Government and a great many Canadians that people drawing unemployment insurance are ripping off the system. That is the attitude of a great many people, including some Members in this Chamber.
I suppose that if you look at the Auditor General's reports you will find some reason to justify that opinion. For example, a Member said this morning that there were several hundred thousand people who had quit their jobs and then drew unemployment insurance. In the Auditor General's report, where most of these figures are found, you see reference to this enormous number of people who had received overpayments or to the UIC paying out X number of millions of dollars when it should not have. You have to realize, Mr. Speaker, that included in that group is a very large number of people who received unemployment insurance because the UIC made a mistake. It is the law in this country that if the UIC makes the mistake, the person has to pay the money back. If the employer made the mistake, the person who received the money must pay it back. If you leave your home community and go some place looking for work and the UIC was not notified, and you are found out, you also have to pay back your benefits for that period of time. Included in that group of people who received unemployment insurance and should not have were those who had helped someone build their house or, if it is a fisherman, who had built a boat during the winter. That person was found out by one of the UIC investigators and he had to pay back all the benefits he received during the entire winter. So, Mr. Speaker, when you look at the figures you have to realize what these cases are, how these overpayments were created, and why that person owed the money to the UIC.
We have seen countless thousands of cases over the last few years of people who received benefits but were then declared not entitled to them by the Commission or its investigators. These people then go before a board of reference and they have the right of appeal to a deputy minister, or to the federal Court of Canada if it is a determination of a question by Revenue Canada, or to an umpire who is also a federal judge.
When you go over some of these cases, Mr. Speaker, you will discover extreme hardship cases. There are people with absolutely no income, and now they owe the federal Government a large amount of money. Those people are included in
Borrowing Authority
the figures tossed about by politicians, the business community and advocates of cutting back unemployment insurance. There are countless cases involving people who, through no fault of their own, have to pay money back to the UIC after receiving it for several years. If there is any humanitarianism in the system at all, Mr. Speaker, if the Minister has any sympathy for these people at all, there is a section in the Act which says that in cases of hardship the Commission can give the money owed to it. It would do far more for the Canadian people if the Minister were to examine that option rather than announcing that she is going to cut $200 million from unemployment insurance and hire 700 people to Find low paying jobs for the unemployed.
Another question comes to mind, Mr. Speaker. These low-paying jobs that I referred to are just that. They have to be low paying because the Federation of Independent Businesses claims that people on unemployment insurance are too comfortable, that they will not accept jobs that pay less than unemployment insurance. Well, you get 60 per cent of your earnings while drawing unemployment insurance. An Hon. Member referred the other day to the fact that the average pay-out to a person on unemployment insurance is $155 a week. He was wrong because it is $155.88 a week. That 88 cents means an awful lot to a poor person sitting in a high unemployment area, and that is all the income he or she gets. The average period of time that someone receives unemployment insurance in Canada, as any Hon. Member knows, is 24 weeks, not a year as was intimated in the statement by the business community the other day. What I am getting at is this. If you are going to put these people into the low paying jobs the Federation is talking about, then you are discriminating against the younger person who has no income at all. You are discriminating against the person who is looking for work and not collecting unemployment insurance. The Minister could turn around and say: ""Oh, no, we are really going to be trying to put these people as well into those jobs"". Well, if so, the Government is not going to save the $200 million that the Minister talked about. She cannot have it both ways. It is one way or the other.

",Liberal,,George Baker,http://www.parl.gc.ca/parlinfo/Files/Parliamentarian.aspx?Item=f6e5da54-c9c9-4020-9356-e92606d6b6c4&Language=E&Section=ALL
3499225,ca.proc.d.1984-11-29.17.4.3,1984-11-29,6116d4fa-3305-4f4b-881b-249e81d2a572,ca.m.9792,Mr. Orlikow:,,GOVERNMENT ORDERS,"BORROWING AUTHORITY ACT, 1984-85 (NO. 2) MEASURE TO ENACT",,"But she is going to try.

",New Democratic Party,,David Orlikow,http://www.parl.gc.ca/parlinfo/Files/Parliamentarian.aspx?Item=6116d4fa-3305-4f4b-881b-249e81d2a572&Language=E&Section=ALL
3499226,ca.proc.d.1984-11-29.17.4.4,1984-11-29,f6e5da54-c9c9-4020-9356-e92606d6b6c4,ca.m.4332,Mr. Baker:,,GOVERNMENT ORDERS,"BORROWING AUTHORITY ACT, 1984-85 (NO. 2) MEASURE TO ENACT",,"Mr. Speaker, if it were not so tragic, it would be humorous that the Government of Canada is trying to do two things with its job creation program. The Minister is going to have more people than ever before working on what I call ""Section 38s"". She will have more people than ever before doing this at the same time that these very poor people are being discriminated against.

",Liberal,,George Baker,http://www.parl.gc.ca/parlinfo/Files/Parliamentarian.aspx?Item=f6e5da54-c9c9-4020-9356-e92606d6b6c4&Language=E&Section=ALL
3499227,ca.proc.d.1984-11-29.17.4.5,1984-11-29,7bd87e49-bca8-45fa-a451-7c1635f2748c,ca.m.6638,The Acting Speaker (Mr. Paproski):,Deputy Chair of Committees of the Whole,GOVERNMENT ORDERS,"BORROWING AUTHORITY ACT, 1984-85 (NO. 2) MEASURE TO ENACT",,"Order, please. It being five o'clock, the House will proceed to the consideration of Private Members' Business as listed on today's Order Paper.

November 29, 1984
Maximum Security Prison

",Progressive Conservative,,Steve Eugene Paproski,http://www.parl.gc.ca/parlinfo/Files/Parliamentarian.aspx?Item=7bd87e49-bca8-45fa-a451-7c1635f2748c&Language=E&Section=ALL
3499228,ca.proc.d.1984-11-29.18,1984-11-29,,,,topic,PRIVATE MEMBERS' BUSINESS-MOTIONS,,,,,,,
3499229,ca.proc.d.1984-11-29.18.1,1984-11-29,,,,subtopic,PRIVATE MEMBERS' BUSINESS-MOTIONS,,,"[""Order. The hour provided for the consideration of Private Members' Business has now expired.\nAdjournment Debate""]",,,,
3499230,ca.proc.d.1984-11-29.18.1.1,1984-11-29,7bd87e49-bca8-45fa-a451-7c1635f2748c,ca.m.6638,The Acting Speaker (Mr. Paproski):,Deputy Chair of Committees of the Whole,PRIVATE MEMBERS' BUSINESS-MOTIONS,,,"Shall all orders and items preceding No. 153 stand by unanimous consent?

",Progressive Conservative,,Steve Eugene Paproski,http://www.parl.gc.ca/parlinfo/Files/Parliamentarian.aspx?Item=7bd87e49-bca8-45fa-a451-7c1635f2748c&Language=E&Section=ALL
3499231,ca.proc.d.1984-11-29.18.1.2,1984-11-29,intervention,,,,PRIVATE MEMBERS' BUSINESS-MOTIONS,,,"Agreed.

",,,Some Hon. Members:,
3499232,ca.proc.d.1984-11-29.18.2,1984-11-29,,,,subtopic,PRIVATE MEMBERS' BUSINESS-MOTIONS,PENITENTIARIES,,,,,,
